Event,Date,Start Time,Time Zone,Location,Venue,URL,Event ID
UFC on FOX: Johnson vs Moraga,2013-07-27,19:55,['GMT-07:00'],"Seattle, Washington, USA",Climate Pledge Arena,https://www.ufc.com/event/FOX8,629
UFC 162: Silva vs Weidman,2013-07-06,23:00,['GMT-07:00'],"Las Vegas, Nevada, USA",MGM Grand Garden Arena,https://www.ufc.com/event/ufc-162,627
UFC 161: Evans vs Henderson,2013-06-15,23:00,['GMT-05:00'],"Winnipeg, Manitoba, Canada",Bell MTS Place,https://www.ufc.com/event/ufc-161,626
UFC on FUEL TV: Nogueira vs. Werdum,2013-06-08,20:45,['GMT-03:00'],"Fortaleza, Ceara, Brazil",Paulo Sarasate Arena,https://www.ufc.com/event/FUEL10,628
UFC 160: Velasquez vs Silva 2,2013-05-25,22:30,['GMT-07:00'],"Las Vegas, Nevada, USA",MGM Grand Garden Arena,https://www.ufc.com/event/ufc-160,624
UFC on FX: Belfort vs. Rockhold,2013-05-18,20:30,['GMT-03:00'],"Jaragua do Sul, Santa Catarina, Brazil",Arena Jaragua,https://www.ufc.com/event/FX8,625
UFC 159: Jones vs Sonnen,2013-04-27,22:30,['GMT-04:00'],"Newark, New Jersey, USA",Prudential Center,https://www.ufc.com/event/ufc-159,620
UFC on FOX: Henderson vs Melendez,2013-04-20,20:00,['GMT-07:00'],"San Jose, California, USA",SAP Center at San Jose,https://www.ufc.com/event/FOX7,621
The Ultimate Fighter: Team Jones vs. Team Sonnen Finale,2013-04-13,22:00,['GMT-07:00'],"Las Vegas, Nevada, USA",Mandalay Bay Events Center,https://www.ufc.com/event/TUF17-Finale,623
UFC on FUEL TV: Mousasi vs Latifi,2013-04-06,14:50,['GMT+02:00'],"Stockholm, , Sweden",Ericsson Globe,https://www.ufc.com/event/FUEL9,622
UFC 158: St-Pierre vs Diaz,2013-03-16,22:30,['GMT-04:00'],"Montreal, Quebec, Canada",Bell Centre,https://www.ufc.com/event/ufc-158,619
UFC on FUEL TV: Silva vs. Stann,2013-03-03,00:00,['GMT+09:00'],"Saitama, , Japan",Saitama Super Arena,https://www.ufc.com/event/FUEL8,618
UFC 157: Rousey vs Carmouche,2013-02-23,23:30,['GMT-08:00'],"Anaheim, California, USA",Honda Center,https://www.ufc.com/event/ufc-157,616
UFC on FUEL TV: Barao vs McDonald,2013-02-16,17:00,['GMT+00:00'],"London, England, United Kingdom","The SSE Arena, Wembley",https://www.ufc.com/event/FUEL7,615
UFC 156: Aldo vs Edgar,2013-02-03,00:00,['GMT-08:00'],"Las Vegas, Nevada, USA",Mandalay Bay Events Center,https://www.ufc.com/event/ufc-156,613
UFC on FOX: Johnson vs Dodson,2013-01-26,21:00,['GMT-06:00'],"Chicago, Illinois, USA",United Center,https://www.ufc.com/event/FOX6,612
UFC on FX: Belfort vs Bisping,2013-01-19,22:00,['GMT-02:00'],"Sao Paulo, , Brazil",Ginasio do Ibirapuera,https://www.ufc.com/event/FX7,614
UFC 155: Dos Santos vs Velasquez II,2012-12-29,23:30,['GMT-08:00'],"Las Vegas, Nevada, USA",MGM Grand Garden Arena,https://www.ufc.com/event/ufc-155,610
The Ultimate Fighter: Team Carwin vs. Team Nelson Finale,2012-12-15,22:30,['GMT-08:00'],"Las Vegas, Nevada, USA",Hard Rock Hotel and Casino,https://www.ufc.com/event/TUF16-Finale,609
UFC on FX: Sotiropoulos vs Pearson,2012-12-14,22:00,['GMT+10:00'],"Gold Coast, Queensland, Australia",Gold Coast Convention and Exhibition Centre,https://www.ufc.com/event/ufc-fx1,602
UFC on FOX: Henderson vs Diaz,2012-12-08,21:20,['GMT-08:00'],"Seattle, Washington, USA",Climate Pledge Arena,https://www.ufc.com/event/FOX5,608
UFC 154: St-Pierre vs Condit,2012-11-17,23:30,['GMT-05:00'],"Montreal, Quebec, Canada",Bell Centre,https://www.ufc.com/event/ufc-154-live-pay-view,600
UFC Macao: Franklin vs Le,2012-11-10,12:00,['GMT+08:00'],"Macau, , China",Cotai Arena,https://www.ufc.com/event/FUEL6,607
UFC 153: Silva vs Bonnar,2012-10-13,23:00,['GMT-03:00'],"Rio de Janeiro, , Brazil",Farmasi Arena,https://www.ufc.com/event/ufc-153,604
UFC on FX: Browne vs Bigfoot,2012-10-05,21:00,['GMT-05:00'],"Minneapolis, Minnesota, USA",Target Center,https://www.ufc.com/event/FX5,603
UFC on FUEL TV: Struve vs Miocic,2012-09-29,17:30,['GMT+01:00'],"Nottingham, England, United Kingdom",Motorpoint Arena Nottingham,https://www.ufc.com/event/FUEL5,598
UFC 152: Jones vs Belfort,2012-09-22,22:45,['GMT-04:00'],"Toronto, Ontario, Canada",Scotiabank Arena,https://www.ufc.com/event/ufc-152,601
UFC 150: Henderson vs Edgar II,2012-08-11,23:00,['GMT-06:00'],"Denver, Colorado, USA",Ball Arena,https://www.ufc.com/event/ufc-150,597
UFC on FOX: Shogun vs Vera,2012-08-04,21:00,['GMT-07:00'],"Los Angeles, California, USA",Staples Center,https://www.ufc.com/event/FOX4,596
UFC 149: Faber vs Barao,2012-07-21,23:00,['GMT-06:00'],"Calgary, Alberta, Canada",Scotiabank Saddledome,https://www.ufc.com/event/ufc-149,592
UFC on FUEL TV: Munoz vs Weidman,2012-07-11,21:00,['GMT-07:00'],"San Jose, California, USA",SAP Center at San Jose,https://www.ufc.com/event/FUEL4,594
UFC 148: Silva vs Sonnen 2,2012-07-07,23:00,['GMT-07:00'],"Las Vegas, Nevada, USA",MGM Grand Garden Arena,https://www.ufc.com/event/ufc-148,591
UFC 147: Silva vs Franklin 2,2012-06-23,22:00,['GMT-03:00'],"Belo Horizonte, Minas Gerais, Brazil",Mineirinho Arena,https://www.ufc.com/event/ufc-147,593
UFC on FX: Maynard vs Guida,2012-06-22,21:00,['GMT-04:00'],"Atlantic City, New Jersey, USA",Revel Resort,https://www.ufc.com/event/FX4,590
UFC on FX: Johnson vs McCall,2012-06-08,21:00,['GMT-04:00'],"Sunrise, Florida, USA",BB&T Center,https://www.ufc.com/event/FX3,588
The Ultimate Fighter: Live Finale,2012-06-01,22:25,['GMT-07:00'],"Las Vegas, Nevada, USA",Pearl Concert Theater,https://www.ufc.com/event/TUF-Live-1-Finale,589
UFC 146: Dos Santos vs Mir,2012-05-26,22:45,['GMT-07:00'],"Las Vegas, Nevada, USA",MGM Grand Garden Arena,https://www.ufc.com/event/ufc-146,586
UFC on FUEL TV: Korean Zombie vs Poirier,2012-05-15,21:00,['GMT-04:00'],"Fairfax, Virginia, USA",EagleBank Arena,https://www.ufc.com/event/FUEL3,585
UFC on FOX: Diaz vs Miller,2012-05-05,20:00,['GMT-04:00'],"East Rutherford, New Jersey, USA",Meadowlands Arena,https://www.ufc.com/event/FOX3,584
UFC 145: Jones vs Evans,2012-04-21,23:00,['GMT-04:00'],"Atlanta, Georgia, USA",State Farm Arena,https://www.ufc.com/event/ufc-145,581
UFC on FUEL TV: Gustafsson vs Silva,2012-04-14,16:00,['GMT+02:00'],"Stockholm, , Sweden",Ericsson Globe,https://www.ufc.com/event/UFCSweden,579
UFC on FX: Alves vs Kampmann,2012-03-02,23:00,['GMT+11:00'],"Sydney, New South Wales, Australia",Qudos Bank Arena,https://www.ufc.com/event/UFCFX2,577
UFC 144: Edgar vs Henderson,2012-02-26,00:00,['GMT+09:00'],"Saitama, , Japan",Saitama Super Arena,https://www.ufc.com/event/ufc-144,572
UFC on FUEL TV: Sanchez vs Ellenberger,2012-02-15,23:00,['GMT-06:00'],"Omaha, Nebraska, USA",Omaha Civic Auditorium,https://www.ufc.com/event/UFCFUEL1,578
UFC 143: Diaz vs Condit,2012-02-05,00:00,['GMT-08:00'],"Las Vegas, Nevada, USA",Mandalay Bay Events Center,https://www.ufc.com/event/ufc-143,575
UFC on FOX: Evans vs Davis,2012-01-28,22:00,['GMT-06:00'],"Chicago, Illinois, USA",United Center,https://www.ufc.com/event/UFCFox2,574
UFC on FX: Guillard vs Miller,2012-01-21,00:00,['GMT-06:00'],"Nashville, Tennessee, USA",Bridgestone Arena,https://www.ufc.com/event/UFCFX1,571
UFC 142: Aldo vs Mendes,2012-01-15,00:30,['GMT-02:00'],"Rio de Janeiro, , Brazil",Farmasi Arena,https://www.ufc.com/event/ufc-142,573
UFC 141: Lesnar vs Overeem,2011-12-31,00:00,['GMT-08:00'],"Las Vegas, Nevada, USA",MGM Grand Garden Arena,https://www.ufc.com/event/ufc-141,568
UFC 140: Jones vs Machida,2011-12-10,22:30,['GMT-05:00'],"Toronto, Ontario, Canada",Scotiabank Arena,https://www.ufc.com/event/ufc-140,566
The Ultimate Fighter: Team Bisping vs Team Miller Finale,2011-12-03,23:00,['GMT-08:00'],"Las Vegas, Nevada, USA",Pearl Concert Theater,https://www.ufc.com/event/TUF14-Finale,565
UFC 139: Shogun vs Henderson,2011-11-19,23:00,['GMT-08:00'],"San Jose, California, USA",SAP Center at San Jose,https://www.ufc.com/event/ufc-139,564
UFC on FOX: Velasquez vs Dos Santos,2011-11-12,21:55,['GMT-08:00'],"Anaheim, California, USA",Honda Center,https://www.ufc.com/event/UFC-on-Fox,561
UFC 138: Leben vs Munoz,2011-11-05,15:00,['GMT+00:00'],"Birmingham, England, United Kingdom",Genting Arena,https://www.ufc.com/event/ufc-138,562
UFC 137: Penn vs Diaz,2011-10-29,22:00,['GMT-07:00'],"Las Vegas, Nevada, USA",Mandalay Bay Events Center,https://www.ufc.com/event/ufc-137,560
UFC 136: Edgar vs Maynard 3,2011-10-08,22:00,['GMT-05:00'],"Houston, Texas, USA",Toyota Center,https://www.ufc.com/event/ufc-136,555
UFC Live: Cruz vs Johnson,2011-10-01,22:00,['GMT-04:00'],"Washington, DC, USA",Capital One Arena,https://www.ufc.com/event/UVS6,558
UFC 135: Jones vs Rampage,2011-09-24,22:00,['GMT-06:00'],"Denver, Colorado, USA",Ball Arena,https://www.ufc.com/event/ufc-135,554
UFC Fight Night: Shields vs Ellenberger,2011-09-17,21:30,['GMT-05:00'],"New Orleans, Louisiana, USA",Ernest N. Morial Convention Center,https://www.ufc.com/event/UFN25,553
UFC 134: Silva vs Okami,2011-08-27,22:00,['GMT-03:00'],"Rio de Janeiro, , Brazil",Farmasi Arena,https://www.ufc.com/event/ufc-134,545
UFC Live: Hardy vs Lytle,2011-08-14,21:00,['GMT-05:00'],"Milwaukee, Wisconsin, USA",Bradley Center,https://www.ufc.com/event/UVS5,551
UFC 133: Evans vs Ortiz 2,2011-08-06,22:00,['GMT-04:00'],"Philadelphia, Pennsylvania, USA",Wells Fargo Center,https://www.ufc.com/event/ufc-133,547
UFC 132: Cruz vs Faber,2011-07-02,22:00,['GMT-07:00'],"Las Vegas, Nevada, USA",MGM Grand Garden Arena,https://www.ufc.com/event/ufc-132,542
UFC Live: Kongo vs Barry,2011-06-26,22:00,['GMT-04:00'],"Pittsburgh, Pennsylvania, USA",PPG Paints Arena,https://www.ufc.com/event/UFCLive4,543
UFC 131: Dos Santos vs Carwin,2011-06-11,22:00,['GMT-07:00'],"Vancouver, British Columbia, Canada",Rogers Arena,https://www.ufc.com/event/ufc-131,540
The Ultimate Fighter: Team Lesnar vs Team dos Santos Finale,2011-06-04,22:00,['GMT-07:00'],"Las Vegas, Nevada, USA",Pearl Concert Theater,https://www.ufc.com/event/TUF13-finale,541
UFC 130: Rampage vs Hamill,2011-05-28,22:00,['GMT-07:00'],"Las Vegas, Nevada, USA",MGM Grand Garden Arena,https://www.ufc.com/event/ufc-130,536
UFC 129: St-Pierre vs Shields,2011-04-30,22:00,['GMT-04:00'],"Toronto, Ontario, Canada",Rogers Centre,https://www.ufc.com/event/ufc-129,534
UFC Fight Night: Nogueira vs Davis,2011-03-26,22:00,['GMT-07:00'],"Seattle, Washington, USA",Climate Pledge Arena,https://www.ufc.com/event/UFN24,533
UFC 128: Shogun vs Jones,2011-03-19,23:00,['GMT-04:00'],"Newark, New Jersey, USA",Prudential Center,https://www.ufc.com/event/ufc-128,528
UFC Live: Sanchez vs Kampmann,2011-03-03,23:00,['GMT-05:00'],"Louisville, Kentucky, USA",KFC Yum! Center,https://www.ufc.com/event/UFCLive3,530
UFC 127: Penn vs Fitch,2011-02-27,00:00,['GMT+11:00'],"Sydney, New South Wales, Australia",Qudos Bank Arena,https://www.ufc.com/event/ufc-127,526
UFC 126: Silva vs Belfort,2011-02-06,00:00,['GMT-08:00'],"Las Vegas, Nevada, USA",Mandalay Bay Events Center,https://www.ufc.com/event/ufc-126,525
UFC Fight Night: Fight for the Troops 2,2011-01-22,23:00,['GMT-06:00'],"Killeen, Texas, USA",Fort Hood,https://www.ufc.com/event/fight-for-the-troops-2,522
UFC 125: Resolution,2011-01-02,00:00,['GMT-08:00'],"Las Vegas, Nevada, USA",MGM Grand Garden Arena,https://www.ufc.com/event/ufc-125,518
UFC 124: St-Pierre vs Koscheck 2,2010-12-12,00:00,['GMT-05:00'],"Montreal, Quebec, Canada",Bell Centre,https://www.ufc.com/event/ufc-124,517
The Ultimate Fighter: Team GSP vs Team Koscheck Finale,2010-12-04,23:00,['GMT-08:00'],"Las Vegas, Nevada, USA",Pearl Concert Theater,https://www.ufc.com/event/TUF12-Finale,507
UFC 123: Rampage vs Machida,2010-11-21,00:00,['GMT-05:00'],"Auburn Hills, Michigan, USA",Palace of Auburn Hills,https://www.ufc.com/event/ufc-123,498
UFC 122: Marquardt vs Okami,2010-11-13,17:00,['GMT+01:00'],"Oberhausen, North Rhine-Westphalia, Germany",Konig Pilsener Arena,https://www.ufc.com/event/ufc-122,497
UFC 121: Lesnar vs Velasquez,2010-10-23,23:00,['GMT-07:00'],"Anaheim, California, USA",Honda Center,https://www.ufc.com/event/ufc-121,494
UFC 120: Bisping vs Akiyama,2010-10-16,16:00,['GMT+01:00'],"London, England, United Kingdom",The O2 Arena,https://www.ufc.com/event/ufc-120,485
UFC 119: Mir vs Cro Cop,2010-09-25,23:00,['GMT-04:00'],"Indianapolis, Indiana, USA",Bankers Life Fieldhouse,https://www.ufc.com/event/ufc-119,484
UFC Fight Night: Marquardt vs Palhares,2010-09-15,21:00,['GMT-05:00'],"Austin, Texas, USA",Frank Erwin Center,https://www.ufc.com/event/ufc-fight-night-palhares-marquardt,479
UFC 118: Edgar vs Penn 2,2010-08-28,23:00,['GMT-04:00'],"Boston, Massachusetts, USA",TD Garden,https://www.ufc.com/event/ufc-118,466
UFC 117: Silva vs Sonnen,2010-08-07,23:00,['GMT-07:00'],"Oakland, California, USA",Oracle Arena,https://www.ufc.com/event/ufc-117,463
UFC Live: Jones vs Matyushenko,2010-08-01,22:00,['GMT-07:00'],"San Diego, California, USA",Pechanga Arena,https://www.ufc.com/event/UFC-Live-JONES-vs-MATYUSHENKO,462
UFC 116: Lesnar vs Carwin,2010-07-03,23:00,['GMT-07:00'],"Las Vegas, Nevada, USA",MGM Grand Garden Arena,https://www.ufc.com/event/ufc-116,457
The Ultimate Fighter: Team Liddell vs Team Ortiz Finale,2010-06-19,22:00,['GMT-07:00'],"Las Vegas, Nevada, USA",Pearl Concert Theater,https://www.ufc.com/event/The-Ultimate-Fighter-Team-Liddell-vs-Team-Ortiz-FINALE,455
UFC 115: Liddell vs Franklin,2010-06-12,23:00,['GMT-07:00'],"Vancouver, British Columbia, Canada",Rogers Arena,https://www.ufc.com/event/ufc-115,449
UFC 114: Rampage vs Evans,2010-05-29,23:00,['GMT-07:00'],"Las Vegas, Nevada, USA",MGM Grand Garden Arena,https://www.ufc.com/event/ufc-114,446
UFC 113: Machida vs Shogun 2,2010-05-08,23:00,['GMT-04:00'],"Montreal, Quebec, Canada",Bell Centre,https://www.ufc.com/event/ufc-113,445
UFC 112: Invincible,2010-04-10,17:00,['GMT+04:00'],"Abu Dhabi, , United Arab Emirates",Ferrari World,https://www.ufc.com/event/ufc-112,437
UFC Fight Night: Florian vs Gomi,2010-03-31,22:00,['GMT-04:00'],"Charlotte, North Carolina, USA",Bojangles Coliseum,https://www.ufc.com/event/UFC-Fight-Night-Florian-vs-Gomi,440
UFC 111: St-Pierre vs Hardy,2010-03-27,23:00,['GMT-04:00'],"Newark, New Jersey, USA",Prudential Center,https://www.ufc.com/event/ufc-111,435
UFC Live: Vera vs Jones,2010-03-21,16:00,['GMT-06:00'],"Broomfield, Colorado, USA",1stBank Center,https://www.ufc.com/event/UFC-on-Versus--Vera-vs-Jones,436
UFC 110: Nogueira vs Velasquez,2010-02-21,00:00,['GMT+11:00'],"Sydney, New South Wales, Australia",Qudos Bank Arena,https://www.ufc.com/event/ufc-110,427
UFC 109: Relentless,2010-02-07,03:00,['GMT-08:00'],"Las Vegas, Nevada, USA",Mandalay Bay Events Center,https://www.ufc.com/event/ufc-109,426
UFC Fight Night: Maynard vs Diaz,2010-01-12,03:00,['GMT-05:00'],"Fairfax, Virginia, USA",EagleBank Arena,https://www.ufc.com/event/UFC-Fight-Night-Maynard-vs-Diaz,425
UFC 108: Evans vs Silva,2010-01-02,05:00,['GMT-08:00'],"Las Vegas, Nevada, USA",MGM Grand Garden Arena,https://www.ufc.com/event/ufc-108,424
UFC 107: Penn vs Sanchez,2009-12-12,05:00,['GMT-06:00'],"Memphis, Tennessee, USA",FedExForum,https://www.ufc.com/event/ufc-107,422
The Ultimate Fighter: Heavyweights Finale,2009-12-05,05:00,['GMT-08:00'],"Las Vegas, Nevada, USA",Pearl Concert Theater,https://www.ufc.com/event/The-Ultimate-Fighter-HEAVYWEIGHTS-Finale,413
UFC 106: Ortiz vs Griffin 2,2009-11-21,05:00,['GMT-08:00'],"Las Vegas, Nevada, USA",Mandalay Bay Events Center,https://www.ufc.com/event/ufc-106,412
UFC 105: Couture vs Vera,2009-11-14,05:00,['GMT+00:00'],"Manchester, England, United Kingdom",Manchester Arena,https://www.ufc.com/event/ufc-105,411
UFC 104: Machida vs Shogun,2009-10-24,04:00,['GMT-07:00'],"Los Angeles, California, USA",Staples Center,https://www.ufc.com/event/ufc-104,316
UFC 103: Franklin vs Belfort,2009-09-19,04:00,['GMT-05:00'],"Dallas, Texas, USA",American Airlines Center,https://www.ufc.com/event/ufc-103,315
UFC Fight Night: Diaz vs Guillard,2009-09-16,04:00,['GMT-05:00'],"Oklahoma City, Oklahoma, USA",Cox Convention Center,https://www.ufc.com/event/UFC-Fight-Night-DIAZ-vs-GUILLARD,314
UFC 102: Couture vs Nogueira,2009-08-29,04:00,['GMT-07:00'],"Portland, Oregon, USA",Moda Center,https://www.ufc.com/event/ufc-102,297
UFC 101: Declaration,2009-08-08,04:00,['GMT-04:00'],"Philadelphia, Pennsylvania, USA",Wells Fargo Center,https://www.ufc.com/event/ufc-101,296
UFC 100,2009-07-11,04:00,['GMT-07:00'],"Las Vegas, Nevada, USA",Mandalay Bay Events Center,https://www.ufc.com/event/ufc-100,295
The Ultimate Fighter: United States vs. United Kingdom Finale,2009-06-20,04:00,['GMT-07:00'],"Las Vegas, Nevada, USA",Pearl Concert Theater,https://www.ufc.com/event/The-Ultimate-Fighter-Team-US-vs-Team-UK-FINALE,294
UFC 99: The Comeback,2009-06-13,04:00,['GMT+02:00'],"Cologne, North Rhine-Westphalia, Germany",Lanxess Arena,https://www.ufc.com/event/ufc-99,293
UFC 98: Evans vs Machida,2009-05-23,04:00,['GMT-07:00'],"Las Vegas, Nevada, USA",MGM Grand Garden Arena,https://www.ufc.com/event/ufc-98,292
UFC 97: Redemption,2009-04-18,04:00,['GMT-04:00'],"Montreal, Quebec, Canada",Bell Centre,https://www.ufc.com/event/ufc-97,267
UFC Fight Night: Condit vs Kampmann,2009-04-01,04:00,['GMT-05:00'],"Nashville, Tennessee, USA",Bridgestone Arena,https://www.ufc.com/event/UFC-Fight-Night-Condit-vs-Kampmann,291
UFC 96: Jackson vs Jardine,2009-03-07,05:00,['GMT-05:00'],"Columbus, Ohio, USA",Nationwide Arena,https://www.ufc.com/event/ufc-96,266
UFC 95: Sanchez vs Stevenson,2009-02-21,05:00,['GMT+00:00'],"London, England, United Kingdom",The O2 Arena,https://www.ufc.com/event/ufc-95,265
UFC Fight Night: Lauzon vs Stephens,2009-02-07,05:00,['GMT-05:00'],"Tampa, Florida, USA",USF Sun Dome,https://www.ufc.com/event/UFC-Fight-Night-Lauzon-vs-Stephens,290
UFC 94: St-Pierre vs Penn 2,2009-01-31,05:00,['GMT-08:00'],"Las Vegas, Nevada, USA",MGM Grand Garden Arena,https://www.ufc.com/event/ufc-94,264
UFC 93: Franklin vs Henderson,2009-01-17,05:00,['GMT+00:00'],"Dublin, Leinster, Ireland",3Arena,https://www.ufc.com/event/ufc-93,263
UFC 92: The Ultimate 2008,2008-12-27,05:00,['GMT-08:00'],"Las Vegas, Nevada, USA",MGM Grand Garden Arena,https://www.ufc.com/event/ufc-92,1
The Ultimate Fighter: Team Nogueira vs. Team Mir Finale,2008-12-13,05:00,['GMT-08:00'],"Las Vegas, Nevada, USA",Pearl Concert Theater,https://www.ufc.com/event/The-Ultimate-Fighter-Finale-Team-Nog-vs-Team-Mir,2
UFC Fight Night - Fight for the Troops,2008-12-10,05:00,['GMT-05:00'],"Fayetteville, North Carolina, USA",Crown Coliseum,https://www.ufc.com/event/UFC-Fight-Night-FIGHT-FOR-THE-TROOPS,3
UFC 91: Couture vs Lesnar,2008-11-15,05:00,['GMT-08:00'],"Las Vegas, Nevada, USA",MGM Grand Garden Arena,https://www.ufc.com/event/ufc-91,4
UFC 90: Silva vs Cote,2008-10-25,04:00,['GMT-05:00'],"Rosemont, Illinois, USA",Allstate Arena,https://www.ufc.com/event/ufc-90,5
UFC 89: Bisping vs Leben,2008-10-18,04:00,['GMT+01:00'],"Birmingham, England, United Kingdom",Barclaycard Arena Birmingham,https://www.ufc.com/event/ufc-89,6
UFC Fight Night: Diaz vs Neer,2008-09-17,04:00,['GMT-05:00'],"Omaha, Nebraska, USA",Omaha Civic Auditorium,https://www.ufc.com/event/UFC-Fight-Night-Diaz-vs-Neer,7
UFC 88: Breakthrough,2008-09-06,04:00,['GMT-04:00'],"Atlanta, Georgia, USA",State Farm Arena,https://www.ufc.com/event/ufc-88,8
UFC 87: Seek And Destroy,2008-08-09,04:00,['GMT-05:00'],"Minneapolis, Minnesota, USA",Target Center,https://www.ufc.com/event/ufc-87,9
UFC: Silva vs Irvin,2008-07-19,04:00,['GMT-07:00'],"Las Vegas, Nevada, USA",Pearl Concert Theater,https://www.ufc.com/event/UFC-Silva-vs-Irvin,10
UFC 86: Jackson vs Griffin,2008-07-05,04:00,['GMT-07:00'],"Las Vegas, Nevada, USA",Mandalay Bay Events Center,https://www.ufc.com/event/ufc-86,11
The Ultimate Fighter: Team Rampage vs Team Forrest Finale,2008-06-21,04:00,['GMT-07:00'],"Las Vegas, Nevada, USA",Pearl Concert Theater,https://www.ufc.com/event/The-Ultimate-Fighter-T-Rampage-vs-T-Forrest-Finale,12
UFC 85: Bedlam,2008-06-07,04:00,['GMT+01:00'],"London, England, United Kingdom",The O2 Arena,https://www.ufc.com/event/ufc-85,13
UFC 84: Ill Will,2008-05-24,04:00,['GMT-07:00'],"Las Vegas, Nevada, USA",MGM Grand Garden Arena,https://www.ufc.com/event/ufc-84,14
UFC 83: Serra vs St-Pierre 2,2008-04-19,04:00,['GMT-04:00'],"Montreal, Quebec, Canada",Bell Centre,https://www.ufc.com/event/ufc-83,15
UFC Fight Night: Florian vs Lauzon,2008-04-02,04:00,['GMT-06:00'],"Broomfield, Colorado, USA",1stBank Center,https://www.ufc.com/event/UFC-Fight-Night-Kenny-Florian-vs-Joe-Lauzon,16
UFC 82: Pride of a Champion,2008-03-01,05:00,['GMT-05:00'],"Columbus, Ohio, USA",Nationwide Arena,https://www.ufc.com/event/ufc-82,17
UFC 81: Breaking Point,2008-02-02,05:00,['GMT-08:00'],"Las Vegas, Nevada, USA",Mandalay Bay Events Center,https://www.ufc.com/event/ufc-81,18
UFC Fight Night: Swick vs Burkman,2008-01-23,05:00,['GMT-08:00'],"Las Vegas, Nevada, USA",Pearl Concert Theater,https://www.ufc.com/event/UFC-Fight-Night-Swick-vs-Burkman,19
UFC 80: Rapid Fire,2008-01-19,05:00,['GMT+00:00'],"Newcastle, England, United Kingdom",Metro Radio Arena,https://www.ufc.com/event/ufc-80,20
UFC 79: Nemesis,2007-12-29,05:00,['GMT-08:00'],"Las Vegas, Nevada, USA",Mandalay Bay Events Center,https://www.ufc.com/event/ufc-79,21
The Ultimate Fighter: Team Hughes vs. Team Serra Finale,2007-12-08,05:00,['GMT-08:00'],"Las Vegas, Nevada, USA",Pearl Concert Theater,https://www.ufc.com/event/ultimate-fighterUltimate-Fighter-Team-Serra-vs-Team-Hughes-Finale,22
UFC 78: Validation,2007-11-17,05:00,['GMT-05:00'],"Newark, New Jersey, USA",Prudential Center,https://www.ufc.com/event/ufc-78,23
UFC 77: Hostile Territory,2007-10-20,04:00,['GMT-04:00'],"Cincinnati, Ohio, USA",U.S. Bank Arena,https://www.ufc.com/event/ufc-77,24
UFC 76: Knockout,2007-09-22,04:00,['GMT-07:00'],"Anaheim, California, USA",Honda Center,https://www.ufc.com/event/ufc-76,25
UFC Fight Night: Thomas vs Florian,2007-09-19,04:00,['GMT-07:00'],"Las Vegas, Nevada, USA",Pearl Concert Theater,https://www.ufc.com/event/UFC-Fight-Night-Din-Thomas-vs-Kenny-Florian,26
UFC 75: Champion vs Champion,2007-09-08,04:00,['GMT+01:00'],"London, England, United Kingdom",The O2 Arena,https://www.ufc.com/event/ufc-75,27
UFC 74: Respect,2007-08-25,04:00,['GMT-07:00'],"Las Vegas, Nevada, USA",Mandalay Bay Events Center,https://www.ufc.com/event/ufc-74,28
UFC 73: Stacked,2007-07-07,04:00,['GMT-07:00'],"Sacramento, California, USA",Sleep Train Arena,https://www.ufc.com/event/ufc-73,29
The Ultimate Fighter: Team Pulver vs. Team Penn Finale,2007-06-23,04:00,['GMT-07:00'],"Las Vegas, Nevada, USA",Pearl Concert Theater,https://www.ufc.com/event/The-Ultimate-Fighter-5-Finale,30
UFC 72: Victory,2007-06-16,04:00,['GMT+01:00'],"Belfast, Northern Ireland, United Kingdom",The Odyssey,https://www.ufc.com/event/ufc-72,31
UFC Fight Night: Stout vs Fisher,2007-06-12,04:00,['GMT-04:00'],"Hollywood, Florida, USA",Seminole Hard Rock Hotel and Casino,https://www.ufc.com/event/UFC-Fight-Night-Sam-Stout-vs-Spencer-Fisher,32
UFC 71: Liddell vs Jackson,2007-05-26,04:00,['GMT-07:00'],"Las Vegas, Nevada, USA",MGM Grand Garden Arena,https://www.ufc.com/event/ufc-71,33
UFC 70: Nations Collide,2007-04-21,04:00,['GMT+01:00'],"Manchester, England, United Kingdom",Manchester Arena,https://www.ufc.com/event/ufc-70,34
UFC 69: Shootout,2007-04-07,04:00,['GMT-05:00'],"Houston, Texas, USA",Toyota Center,https://www.ufc.com/event/ufc-69,35
UFC Fight Night: Stevenson vs Guillard,2007-04-05,04:00,['GMT-07:00'],"Las Vegas, Nevada, USA",Pearl Concert Theater,https://www.ufc.com/event/UFC-Fight-Night-Stevenson-vs-Guillard,36
UFC 68: The Uprising,2007-03-03,05:00,['GMT-05:00'],"Columbus, Ohio, USA",Nationwide Arena,https://www.ufc.com/event/ufc-68,37
UFC 67: All or Nothing,2007-02-03,05:00,['GMT-08:00'],"Las Vegas, Nevada, USA",Mandalay Bay Events Center,https://www.ufc.com/event/ufc-67,38
UFC Fight Night: Evans vs Salmon,2007-01-25,05:00,['GMT-05:00'],"Hollywood, Florida, USA",Seminole Hard Rock Hotel and Casino,https://www.ufc.com/event/UFC-Fight-Night-Rashad-Evans-vs-Sean-Salmon,39
UFC 66: Liddell vs Ortiz 2,2006-12-30,05:00,['GMT-08:00'],"Las Vegas, Nevada, USA",MGM Grand Garden Arena,https://www.ufc.com/event/ufc-66,40
UFC Fight Night: Sanchez vs Riggs,2006-12-13,05:00,['GMT-08:00'],"San Diego, California, USA",MCAS Miramar,https://www.ufc.com/event/UFC-Fight-Night-Sanchez-vs-Riggs,41
UFC 65: Bad Intentions,2006-11-18,05:00,['GMT-08:00'],"Sacramento, California, USA",Sleep Train Arena,https://www.ufc.com/event/ufc-65,42
The Ultimate Fighter: The Comeback Finale,2006-11-11,05:00,['GMT-08:00'],"Las Vegas, Nevada, USA",Hard Rock Hotel and Casino,https://www.ufc.com/event/The-Ultimate-Fighter-4-Finale,43
UFC 64: Unstoppable,2006-10-14,04:00,['GMT-07:00'],"Las Vegas, Nevada, USA",Mandalay Bay Events Center,https://www.ufc.com/event/ufc-64,44
Ortiz vs Shamrock 3: The Final Chapter,2006-10-10,04:00,['GMT-04:00'],"Hollywood, Florida, USA",Seminole Hard Rock Hotel and Casino,https://www.ufc.com/event/Ortiz-vs-Shamrock-3--The-Final-Chapter,45
UFC 63: Hughes vs Penn,2006-09-23,04:00,['GMT-07:00'],"Anaheim, California, USA",Honda Center,https://www.ufc.com/event/ufc-63,46
UFC 62: Liddell vs Sobral,2006-08-26,04:00,['GMT-07:00'],"Las Vegas, Nevada, USA",Mandalay Bay Events Center,https://www.ufc.com/event/ufc-62,47
UFC Fight Night 6,2006-08-17,04:00,['GMT-07:00'],"Las Vegas, Nevada, USA",Red Rock Resort Spa and Casino,https://www.ufc.com/event/UFC-Fight-Night-6,48
UFC 61: Bitter Rivals,2006-07-08,04:00,['GMT-07:00'],"Las Vegas, Nevada, USA",Mandalay Bay Events Center,https://www.ufc.com/event/ufc-61,49
UFC Fight Night 5,2006-06-28,04:00,['GMT-07:00'],"Las Vegas, Nevada, USA",Hard Rock Hotel and Casino,https://www.ufc.com/event/ufc-fight-night-7,50
The Ultimate Fighter: Team Ortiz vs. Team Shamrock Finale,2006-06-24,04:00,['GMT-07:00'],"Las Vegas, Nevada, USA",Hard Rock Hotel and Casino,https://www.ufc.com/event/The-Ultimate-Fighter-3-Finale,51
UFC 60: Hughes vs Gracie,2006-05-27,04:00,['GMT-07:00'],"Los Angeles, California, USA",Staples Center,https://www.ufc.com/event/ufc-60,52
UFC 59: Reality Check,2006-04-15,04:00,['GMT-07:00'],"Anaheim, California, USA",Honda Center,https://www.ufc.com/event/ufc-59,53
