Event,Date,Start Time,Time Zone,Location,Venue,URL,Event ID
UFC Fight Night: Adesanya vs. Imavov,2025-02-01,14:00,['GMT+03:00'],"Riyadh, Riyadh, Saudi Arabia",anb Arena,https://www.ufc.com/event/ufc-fight-night-February-1-2025,1243
UFC 311: Makhachev vs. Moicano,2025-01-18,23:00,['GMT-08:00'],"Inglewood, California, USA",Intuit Dome,https://www.ufc.com/event/ufc-311,1242
UFC Fight Night: Dern vs. Ribas 2,2025-01-11,21:00,['GMT-08:00'],"Las Vegas, Nevada, USA",UFC Apex,https://www.ufc.com/event/ufc-fight-night-January-11-2025,1241
UFC Fight Night: Covington vs. Buckley,2024-12-15,00:00,['GMT-05:00'],"Tampa, Florida, USA",Amalie Arena,https://www.ufc.com/event/ufc-fight-night-December-15-2024,1238
UFC 310: Pantoja vs. Asakura,2024-12-07,23:00,['GMT-08:00'],"Las Vegas, Nevada, USA",T-Mobile Arena,https://www.ufc.com/event/ufc-310,1237
UFC Fight Night: Yan vs. Figueiredo,2024-11-23,08:00,['GMT+08:00'],"Macau, , China",Galaxy Arena,https://www.ufc.com/event/ufc-fight-night-November-23-2024,1236
UFC 309: Jones vs. Miocic,2024-11-16,23:00,['GMT-05:00'],"New York City, New York, USA",Madison Square Garden,https://www.ufc.com/event/ufc-309,1235
UFC Fight Night: Magny vs. Prates,2024-11-09,21:00,['GMT-08:00'],"Las Vegas, Nevada, USA",UFC Apex,https://www.ufc.com/event/ufc-fight-night-November-9-2024,1229
UFC Fight Night: Moreno vs. Albazi,2024-11-02,21:00,['GMT-06:00'],"Edmonton, Alberta, Canada",Rogers Place,https://www.ufc.com/event/ufc-fight-night-November-2-2024,1224
UFC 308: Topuria vs. Holloway,2024-10-26,14:00,['GMT+04:00'],"Abu Dhabi, Abu Dhabi, United Arab Emirates",Etihad Arena,https://www.ufc.com/event/ufc-308,1223
UFC Fight Night: Hernandez vs. Pereira,2024-10-19,20:00,['GMT-07:00'],"Las Vegas, Nevada, USA",UFC Apex,https://www.ufc.com/event/ufc-fight-night-October-19-2024,1230
UFC Fight Night: Royval vs. Taira,2024-10-12,20:00,['GMT-07:00'],"Las Vegas, Nevada, USA",UFC Apex,https://www.ufc.com/event/ufc-fight-night-October-12-2024,1231
UFC 307: Pereira vs. Rountree Jr.,2024-10-05,22:30,['GMT-06:00'],"Salt Lake City, Utah, USA",Delta Center,https://www.ufc.com/event/ufc-307,1225
UFC Fight Night: Moicano vs. Saint Denis,2024-09-28,16:00,['GMT+02:00'],"Paris, Ile-de-France, France",Accor Arena,https://www.ufc.com/event/ufc-fight-night-September-28-2024,1213
UFC 306: Riyadh Season Noche UFC,2024-09-14,23:30,['GMT-07:00'],"Las Vegas, Nevada, USA",Sphere,https://www.ufc.com/event/riyadh-season-noche-ufc,1221
UFC Fight Night: Burns vs. Brady,2024-09-07,20:00,['GMT-07:00'],"Las Vegas, Nevada, USA",UFC Apex,https://www.ufc.com/event/ufc-fight-night-September-7-2024,1214
UFC Fight Night: Cannonier vs. Borralho,2024-08-24,23:00,['GMT-07:00'],"Las Vegas, Nevada, USA",UFC Apex,https://www.ufc.com/event/ufc-fight-night-August-24-2024,1218
UFC 305: Du Plessis vs. Adesanya,2024-08-17,22:30,['GMT+08:00'],"Perth, Western Australia, Australia",RAC Arena,https://www.ufc.com/event/ufc-305,1209
UFC Fight Night: Tybura vs. Spivac 2,2024-08-10,21:00,['GMT-07:00'],"Las Vegas, Nevada, USA",UFC Apex,https://www.ufc.com/event/ufc-fight-night-August-10-2024,1217
UFC Fight Night: Sandhagen vs. Nurmagomedov,2024-08-03,16:00,['GMT+04:00'],"Abu Dhabi, Abu Dhabi, United Arab Emirates",Etihad Arena,https://www.ufc.com/event/ufc-fight-night-August-3-2024,1202
UFC 304: Edwards vs. Muhammad 2,2024-07-27,22:00,['GMT+01:00'],"Manchester, England, United Kingdom",Co-op Live,https://www.ufc.com/event/ufc-304,1208
UFC Fight Night: Lemos vs. Jandiroba,2024-07-20,21:30,['GMT-07:00'],"Las Vegas, Nevada, USA",UFC Apex,https://www.ufc.com/event/ufc-fight-night-July-20-2024,1211
UFC Fight Night: Namajunas vs. Cortez,2024-07-13,23:00,['GMT-06:00'],"Denver, Colorado, USA",Ball Arena,https://www.ufc.com/event/ufc-fight-night-July-13-2024,1212
UFC 303: Pereira vs. Prochazka 2,2024-06-29,22:00,['GMT-07:00'],"Las Vegas, Nevada, USA",T-Mobile Arena,https://www.ufc.com/event/ufc-303,1201
UFC Fight Night: Whittaker vs. Aliskerov,2024-06-22,16:00,['GMT+03:00'],"Riyadh, Riyadh, Saudi Arabia",Kingdom Arena,https://www.ufc.com/event/ufc-fight-night-June-22-2024,1200
UFC Fight Night: Perez vs. Taira,2024-06-15,23:00,['GMT-07:00'],"Las Vegas, Nevada, USA",UFC Apex,https://www.ufc.com/event/ufc-fight-night-June-15-2024,1210
UFC Fight Night: Cannonier vs. Imavov,2024-06-08,21:00,['GMT-04:00'],"Louisville, Kentucky, USA",KFC Yum! Center,https://www.ufc.com/event/ufc-fight-night-June-8-2024,1207
UFC 302: Makhachev vs. Poirier,2024-06-01,22:00,['GMT-04:00'],"Newark, New Jersey, USA",Prudential Center,https://www.ufc.com/event/ufc-302,1204
UFC Fight Night: Barboza vs. Murphy,2024-05-18,20:00,['GMT-07:00'],"Las Vegas, Nevada, USA",UFC Apex,https://www.ufc.com/event/ufc-fight-night-May-18-2024,1203
UFC Fight Night: Lewis vs. Nascimento,2024-05-11,20:00,['GMT-05:00'],"St. Louis, Missouri, USA",Enterprise Center,https://www.ufc.com/event/ufc-fight-night-May-11-2024,1199
UFC 301: Pantoja vs. Erceg,2024-05-04,22:00,['GMT-03:00'],"Rio de Janeiro, Rio de Janeiro, Brazil",Farmasi Arena,https://www.ufc.com/event/ufc-301,1197
UFC Fight Night: Nicolau vs. Perez,2024-04-27,20:00,['GMT-07:00'],"Las Vegas, Nevada, USA",UFC Apex,https://www.ufc.com/event/ufc-fight-night-April-27-2024,1198
UFC 300: Pereira vs. Hill,2024-04-13,22:00,['GMT-07:00'],"Las Vegas, Nevada, USA",T-Mobile Arena,https://www.ufc.com/event/ufc-300,1192
UFC Fight Night: Allen vs. Curtis 2,2024-04-06,19:00,['GMT-07:00'],"Las Vegas, Nevada, USA",UFC Apex,https://www.ufc.com/event/ufc-fight-night-April-6-2024,1193
UFC Fight Night: Blanchfield vs. Fiorot,2024-03-30,23:00,['GMT-04:00'],"Atlantic City, New Jersey, USA",Boardwalk Hall,https://www.ufc.com/event/ufc-fight-night-March-30-2024,1191
UFC Fight Night: Ribas vs. Namajunas,2024-03-23,23:00,['GMT-07:00'],"Las Vegas, Nevada, USA",UFC Apex,https://www.ufc.com/event/ufc-fight-night-March-23-2024,1196
UFC Fight Night: Tuivasa vs. Tybura,2024-03-16,20:00,['GMT-07:00'],"Las Vegas, Nevada, USA",UFC Apex,https://www.ufc.com/event/ufc-fight-night-March-16-2024,1195
UFC 299: O'Malley vs. Vera 2,2024-03-09,23:00,['GMT-05:00'],"Miami, Florida, USA",Kaseya Center,https://www.ufc.com/event/ufc-299,1187
UFC Fight Night: Rozenstruik vs. Gaziev,2024-03-02,18:30,['GMT-08:00'],"Las Vegas, Nevada, USA",UFC Apex,https://www.ufc.com/event/ufc-fight-night-March-2-2024,1190
UFC Fight Night: Moreno vs. Royval 2,2024-02-25,00:00,['GMT-06:00'],"Mexico City, Distrito Federal, Mexico",Arena CDMX,https://www.ufc.com/event/ufc-fight-night-February-25-2024,1189
UFC 298: Volkanovski vs. Topuria,2024-02-17,23:30,['GMT-08:00'],"Anaheim, California, USA",Honda Center,https://www.ufc.com/event/ufc-298,1183
UFC Fight Night: Hermansson vs. Pyfer,2024-02-10,21:00,['GMT-08:00'],"Las Vegas, Nevada, USA",UFC Apex,https://www.ufc.com/event/ufc-fight-night-February-10-2024,1186
UFC Fight Night: Dolidze vs. Imavov,2024-02-03,21:00,['GMT-08:00'],"Las Vegas, Nevada, USA",UFC Apex,https://www.ufc.com/event/ufc-fight-night-February-3-2024,1188
UFC 297: Strickland vs. Du Plessis,2024-01-20,23:30,['GMT-05:00'],"Toronto, Ontario, Canada",Scotiabank Arena,https://www.ufc.com/event/ufc-297,1182
UFC Fight Night: Ankalaev vs. Walker 2,2024-01-13,21:00,['GMT-08:00'],"Las Vegas, Nevada, USA",UFC Apex,https://www.ufc.com/event/ufc-fight-night-January-13-2024,1185
UFC 296: Edwards vs. Covington,2023-12-16,23:30,['GMT-08:00'],"Las Vegas, Nevada, USA",T-Mobile Arena,https://www.ufc.com/event/ufc-296,1180
UFC Fight Night: Song vs. Gutierrez,2023-12-10,00:30,['GMT-08:00'],"Las Vegas, Nevada, USA",UFC Apex,https://www.ufc.com/event/ufc-fight-night-December-10-2023,1184
UFC Fight Night: Dariush vs. Tsarukyan,2023-12-02,21:00,['GMT-06:00'],"Austin, Texas, USA",Moody Center,https://www.ufc.com/event/ufc-fight-night-December-2-2023,1181
UFC Fight Night: Allen vs. Craig,2023-11-18,19:00,['GMT-08:00'],"Las Vegas, Nevada, USA",UFC Apex,https://www.ufc.com/event/ufc-fight-night-November-18-2023,1172
UFC 295: Prochazka vs. Pereira,2023-11-11,23:00,['GMT-05:00'],"New York City, New York, USA",Madison Square Garden,https://www.ufc.com/event/ufc-295,1164
UFC Fight Night: Almeida vs. Lewis,2023-11-04,22:00,,"Sao Paulo, Sao Paulo, Brazil",Ginasio do Ibirapuera,https://www.ufc.com/event/ufc-fight-night-November-4-2023,1171
UFC 294: Makhachev vs. Volkanovski 2,2023-10-21,14:00,['GMT+04:00'],"Abu Dhabi, Abu Dhabi, United Arab Emirates",Etihad Arena,https://www.ufc.com/event/ufc-294,1151
UFC Fight Night: Yusuff vs. Barboza,2023-10-14,20:00,['GMT-07:00'],"Las Vegas, Nevada, USA",UFC Apex,https://www.ufc.com/event/ufc-fight-night-October-14-2023,1179
UFC Fight Night: Dawson vs. Green,2023-10-07,20:00,['GMT-07:00'],"Las Vegas, Nevada, USA",UFC Apex,https://www.ufc.com/event/ufc-fight-night-October-7-2023,1178
UFC Fight Night: Fiziev vs. Gamrot,2023-09-23,20:00,['GMT-07:00'],"Las Vegas, Nevada, USA",UFC Apex,https://www.ufc.com/event/ufc-fight-night-September-23-2023,1170
UFC Fight Night: Grasso vs. Shevchenko 2,2023-09-16,23:00,['GMT-07:00'],"Las Vegas, Nevada, USA",T-Mobile Arena,https://www.ufc.com/event/ufc-fight-night-September-16-2023,1162
UFC 293: Adesanya vs. Strickland,2023-09-09,22:30,['GMT+10:00'],"Sydney, New South Wales, Australia",Qudos Bank Arena,https://www.ufc.com/event/ufc-293,1158
UFC Fight Night: Gane vs. Spivac,2023-09-02,16:30,['GMT+02:00'],"Paris, Ile-de-France, France",Accor Arena,https://www.ufc.com/event/ufc-fight-night-September-2-2023,1159
UFC Fight Night: Holloway vs. The Korean Zombie,2023-08-26,09:00,['GMT+08:00'],"Kallang, , Singapore",Singapore Indoor Stadium,https://www.ufc.com/event/ufc-fight-night-August-26-2023,1161
UFC 292: Sterling vs. O'Malley,2023-08-19,22:30,['GMT-04:00'],"Boston, Massachusetts, USA",TD Garden,https://www.ufc.com/event/ufc-292,1156
UFC Fight Night: Luque vs. Dos Anjos,2023-08-12,20:00,['GMT-07:00'],"Las Vegas, Nevada, USA",UFC Apex,https://www.ufc.com/event/ufc-fight-night-August-12-2023,1157
UFC Fight Night: Sandhagen vs. Font,2023-08-05,22:00,['GMT-05:00'],"Nashville, Tennessee, USA",Bridgestone Arena,https://www.ufc.com/event/ufc-fight-night-August-5-2023,1160
UFC 291: Poirier vs. Gaethje 2,2023-07-29,23:00,['GMT-06:00'],"Salt Lake City, Utah, USA",Delta Center,https://www.ufc.com/event/ufc-291,1155
UFC Fight Night: Aspinall vs. Tybura,2023-07-22,16:00,['GMT+01:00'],"London, England, United Kingdom",The O2 Arena,https://www.ufc.com/event/ufc-fight-night-July-22-2023,1150
UFC Fight Night: Holm vs. Bueno Silva,2023-07-15,23:00,['GMT-07:00'],"Las Vegas, Nevada, USA",UFC Apex,https://www.ufc.com/event/ufc-fight-night-July-15-2023,1154
UFC 290: Volkanovski vs. Rodriguez,2023-07-08,22:00,['GMT-07:00'],"Las Vegas, Nevada, USA",T-Mobile Arena,https://www.ufc.com/event/ufc-290,1138
UFC Fight Night: Strickland vs. Magomedov,2023-07-01,20:00,['GMT-07:00'],"Las Vegas, Nevada, USA",UFC Apex,https://www.ufc.com/event/ufc-fight-night-July-1-2023,1149
UFC Fight Night: Emmett vs. Topuria,2023-06-24,15:30,['GMT-04:00'],"Jacksonville, Florida, USA",Vystar Veterans Memorial Arena,https://www.ufc.com/event/ufc-fight-night-June-24-2023,1148
UFC Fight Night: Vettori vs. Cannonier,2023-06-17,23:00,['GMT-07:00'],"Las Vegas, Nevada, USA",UFC Apex,https://www.ufc.com/event/ufc-fight-night-June-17-2023,1147
UFC 289: Nunes vs. Aldana,2023-06-10,23:00,['GMT-07:00'],"Vancouver, British Columbia, Canada",Rogers Arena,https://www.ufc.com/event/ufc-289,1144
UFC Fight Night: Kara-France vs. Albazi,2023-06-03,22:00,['GMT-07:00'],"Las Vegas, Nevada, USA",UFC Apex,https://www.ufc.com/event/ufc-fight-night-June-3-2023,1146
UFC Fight Night: Dern vs. Hill,2023-05-20,20:00,['GMT-07:00'],"Las Vegas, Nevada, USA",UFC Apex,https://www.ufc.com/event/ufc-fight-night-May-20-2023,1145
UFC Fight Night: Rozenstruik vs. Almeida,2023-05-13,16:00,['GMT-04:00'],"Charlotte, North Carolina, USA",Spectrum Center,https://www.ufc.com/event/ufc-fight-night-May-13-2023,1143
UFC 288: Sterling vs. Cejudo,2023-05-06,22:30,['GMT-04:00'],"Newark, New Jersey, USA",Prudential Center,https://www.ufc.com/event/ufc-288,1139
UFC Fight Night: Song vs. Simon,2023-04-29,20:00,['GMT-07:00'],"Las Vegas, Nevada, USA",UFC Apex,https://www.ufc.com/event/ufc-fight-night-April-29-2023,1142
UFC Fight Night: Pavlovich vs. Blaydes,2023-04-22,20:30,['GMT-07:00'],"Las Vegas, Nevada, USA",UFC Apex,https://www.ufc.com/event/ufc-fight-night-April-22-2023,1137
UFC Fight Night: Holloway vs. Allen,2023-04-15,21:30,['GMT-05:00'],"Kansas City, Missouri, USA",T-Mobile Center,https://www.ufc.com/event/ufc-fight-night-April-15-2023,1136
UFC 287: Pereira vs. Adesanya 2,2023-04-08,22:00,['GMT-04:00'],"Miami, Florida, USA",Kaseya Center,https://www.ufc.com/event/ufc-287,1135
UFC Fight Night: Vera vs. Sandhagen,2023-03-25,20:30,['GMT-05:00'],"San Antonio, Texas, USA",AT&T Center,https://www.ufc.com/event/ufc-fight-night-March-25-2023,1133
UFC 286: Edwards vs. Usman 3,2023-03-18,16:30,['GMT+00:00'],"London, England, United Kingdom",The O2 Arena,https://www.ufc.com/event/ufc-286,1132
UFC Fight Night: Yan vs. Dvalishvili,2023-03-11,20:00,['GMT-08:00'],"Las Vegas, Nevada, USA",The Theater at Virgin Hotels Las Vegas,https://www.ufc.com/event/ufc-fight-night-March-11-2023,1131
UFC 285: Jones vs. Gane,2023-03-04,22:30,['GMT-08:00'],"Las Vegas, Nevada, USA",T-Mobile Arena,https://www.ufc.com/event/ufc-285,1130
UFC Fight Night: Muniz vs. Allen,2023-02-25,21:30,['GMT-08:00'],"Las Vegas, Nevada, USA",UFC Apex,https://www.ufc.com/event/ufc-fight-night-February-25-2023,1129
UFC Fight Night: Andrade vs. Blanchfield,2023-02-18,21:00,['GMT-08:00'],"Las Vegas, Nevada, USA",UFC Apex,https://www.ufc.com/event/ufc-fight-night-February-18-2023,1128
UFC 284: Makhachev vs. Volkanovski,2023-02-11,23:00,['GMT+08:00'],"Perth, Western Australia, Australia",RAC Arena,https://www.ufc.com/event/ufc-284,1126
UFC Fight Night: Lewis vs. Spivac,2023-02-05,03:00,['GMT-08:00'],"Las Vegas, Nevada, USA",UFC Apex,https://www.ufc.com/event/ufc-fight-night-February-5-2023,1134
UFC 283: Teixeira vs. Hill,2023-01-21,22:30,['GMT-03:00'],"Rio de Janeiro, Rio de Janeiro, Brazil",Farmasi Arena,https://www.ufc.com/event/ufc-283,1125
UFC Fight Night: Strickland vs. Imavov,2023-01-14,21:00,['GMT-08:00'],"Las Vegas, Nevada, USA",UFC Apex,https://www.ufc.com/event/ufc-fight-night-January-14-2023,1127
UFC Fight Night: Cannonier vs. Strickland,2022-12-17,21:00,['GMT-08:00'],"Las Vegas, Nevada, USA",UFC Apex,https://www.ufc.com/event/ufc-fight-night-December-17-2022,1118
UFC 282: Blachowicz vs. Ankalaev,2022-12-10,23:30,['GMT-08:00'],"Las Vegas, Nevada, USA",T-Mobile Arena,https://www.ufc.com/event/ufc-282,1124
UFC Fight Night: Thompson vs. Holland,2022-12-04,00:00,['GMT-05:00'],"Orlando, Florida, USA",Amway Center,https://www.ufc.com/event/ufc-fight-night-December-4-2022,1123
UFC Fight Night: Nzechukwu vs. Cutelaba,2022-11-19,18:00,['GMT-08:00'],"Las Vegas, Nevada, USA",UFC Apex,https://www.ufc.com/event/ufc-fight-night-November-19-2022,1122
UFC 281: Adesanya vs. Pereira,2022-11-12,23:00,['GMT-05:00'],"New York City, New York, USA",Madison Square Garden,https://www.ufc.com/event/ufc-281,1114
UFC Fight Night: Rodriguez vs. Lemos,2022-11-05,20:00,['GMT-07:00'],"Las Vegas, Nevada, USA",UFC Apex,https://www.ufc.com/event/ufc-fight-night-November-5-2022,1119
UFC Fight Night: Kattar vs. Allen,2022-10-29,20:00,['GMT-07:00'],"Las Vegas, Nevada, USA",UFC Apex,https://www.ufc.com/event/ufc-fight-night-October-29-2022,1116
UFC 280: Oliveira vs. Makhachev,2022-10-22,14:30,['GMT+04:00'],"Abu Dhabi, Abu Dhabi, United Arab Emirates",Etihad Arena,https://www.ufc.com/event/ufc-280,1107
UFC Fight Night: Grasso vs. Araujo,2022-10-15,20:00,['GMT-07:00'],"Las Vegas, Nevada, USA",UFC Apex,https://www.ufc.com/event/ufc-fight-night-October-15-2022,1115
UFC Fight Night: Dern vs. Yan,2022-10-01,20:00,['GMT-07:00'],"Las Vegas, Nevada, USA",UFC Apex,https://www.ufc.com/event/ufc-fight-night-October-1-2022,1117
UFC Fight Night: Sandhagen vs. Song,2022-09-17,20:00,['GMT-07:00'],"Las Vegas, Nevada, USA",UFC Apex,https://www.ufc.com/event/ufc-fight-night-September-17-2022,1106
UFC 279: Diaz vs. Ferguson,2022-09-10,22:00,['GMT-07:00'],"Las Vegas, Nevada, USA",T-Mobile Arena,https://www.ufc.com/event/ufc-279,1113
UFC Fight Night: Gane vs. Tuivasa,2022-09-03,16:00,['GMT+02:00'],"Paris, Ile-de-France, France",Accor Arena,https://www.ufc.com/event/ufc-fight-night-september-03-2022,1097
UFC 278: Usman vs. Edwards,2022-08-20,22:30,['GMT-06:00'],"Salt Lake City, Utah, USA",Delta Center,https://www.ufc.com/event/ufc-278,1099
UFC Fight Night: Vera vs. Cruz,2022-08-13,20:00,['GMT-07:00'],"San Diego, California, USA",Pechanga Arena,https://www.ufc.com/event/ufc-fight-night-August-13-2022,1105
UFC Fight Night: Santos vs. Hill,2022-08-06,23:30,['GMT-07:00'],"Las Vegas, Nevada, USA",UFC Apex,https://www.ufc.com/event/ufc-fight-night-august-06-2022,1096
UFC 277: Pena vs. Nunes 2,2022-07-30,22:00,['GMT-05:00'],"Dallas, Texas, USA",American Airlines Center,https://www.ufc.com/event/ufc-277,1095
UFC Fight Night: Blaydes vs. Aspinall,2022-07-23,16:00,['GMT+01:00'],"London, England, United Kingdom",The O2 Arena,https://www.ufc.com/event/ufc-fight-night-july-23-2022,1088
UFC Fight Night: Ortega vs. Rodriguez,2022-07-16,15:00,['GMT-04:00'],"Elmont, New York, USA",UBS Arena,https://www.ufc.com/event/ufc-fight-night-july-16-2022,1098
UFC Fight Night: Dos Anjos vs. Fiziev,2022-07-09,22:00,['GMT-07:00'],"Las Vegas, Nevada, USA",UFC Apex,https://www.ufc.com/event/ufc-fight-night-july-09-2022,1086
UFC 276: Adesanya vs. Cannonier,2022-07-02,22:00,['GMT-07:00'],"Las Vegas, Nevada, USA",T-Mobile Arena,https://www.ufc.com/event/ufc-276,1089
UFC Fight Night: Tsarukyan vs. Gamrot,2022-06-25,23:00,['GMT-07:00'],"Las Vegas, Nevada, USA",UFC Apex,https://www.ufc.com/event/ufc-fight-night-june-25-2022,1090
UFC Fight Night: Kattar vs. Emmett,2022-06-18,20:00,['GMT-05:00'],"Austin, Texas, USA",Moody Center,https://www.ufc.com/event/ufc-fight-night-june-18-2022,1087
UFC 275: Teixeira vs. Prochazka,2022-06-11,23:00,['GMT+08:00'],"Kallang, , Singapore",Singapore Indoor Stadium,https://www.ufc.com/event/ufc-275,1083
UFC Fight Night: Volkov vs. Rozenstruik,2022-06-04,17:00,['GMT-07:00'],"Las Vegas, Nevada, USA",UFC Apex,https://www.ufc.com/event/ufc-fight-night-june-04-2022,1085
UFC Fight Night: Holm vs. Vieira,2022-05-21,20:00,['GMT-07:00'],"Las Vegas, Nevada, USA",UFC Apex,https://www.ufc.com/event/ufc-fight-night-may-21-2022,1082
UFC Fight Night: Blachowicz vs. Rakic,2022-05-14,23:30,['GMT-07:00'],"Las Vegas, Nevada, USA",UFC Apex,https://www.ufc.com/event/ufc-fight-night-may-14-2022,1084
UFC 274: Oliveira vs. Gaethje,2022-05-07,21:30,['GMT-07:00'],"Phoenix, Arizona, USA",Footprint Center,https://www.ufc.com/event/ufc-274,1081
UFC Fight Night: Font vs. Vera,2022-04-30,20:00,['GMT-07:00'],"Las Vegas, Nevada, USA",UFC Apex,https://www.ufc.com/event/ufc-fight-night-april-30-2022,1080
UFC Fight Night: Lemos vs. Andrade,2022-04-23,22:00,['GMT-07:00'],"Las Vegas, Nevada, USA",UFC Apex,https://www.ufc.com/event/ufc-fight-night-april-23-2022,1078
UFC Fight Night: Luque vs. Muhammad,2022-04-16,21:30,['GMT-07:00'],"Las Vegas, Nevada, USA",UFC Apex,https://www.ufc.com/event/ufc-fight-night-april-16-2022,1077
UFC 273: Volkanovski vs. The Korean Zombie,2022-04-09,22:30,['GMT-04:00'],"Jacksonville, Florida, USA",Vystar Veterans Memorial Arena,https://www.ufc.com/event/ufc-273,1079
UFC Fight Night: Blaydes vs. Daukaus,2022-03-26,20:00,['GMT-04:00'],"Columbus, Ohio, USA",Nationwide Arena,https://www.ufc.com/event/ufc-fight-night-march-26-2022,1071
UFC Fight Night: Volkov vs. Aspinall,2022-03-19,17:30,['GMT+00:00'],"London, England, United Kingdom",The O2 Arena,https://www.ufc.com/event/ufc-fight-night-march-19-2022,1076
UFC Fight Night: Santos vs. Ankalaev,2022-03-12,21:00,['GMT-08:00'],"Las Vegas, Nevada, USA",UFC Apex,https://www.ufc.com/event/ufc-fight-night-march-12-2022,1073
UFC 272: Covington vs. Masvidal,2022-03-05,23:00,['GMT-08:00'],"Las Vegas, Nevada, USA",T-Mobile Arena,https://www.ufc.com/event/ufc-272,1070
UFC Fight Night: Makhachev vs. Green,2022-02-26,21:00,['GMT-08:00'],"Las Vegas, Nevada, USA",UFC Apex,https://www.ufc.com/event/ufc-fight-night-february-26-2022,1075
UFC Fight Night: Walker vs. Hill,2022-02-19,21:00,['GMT-08:00'],"Las Vegas, Nevada, USA",UFC Apex,https://www.ufc.com/event/ufc-fight-night-february-19-2022,1074
UFC 271: Adesanya vs. Whittaker 2,2022-02-12,23:00,,"Houston, Texas, USA",Toyota Center,https://www.ufc.com/event/ufc-271,1069
UFC Fight Night: Hermansson vs. Strickland,2022-02-05,21:00,['GMT-08:00'],"Las Vegas, Nevada, USA",UFC Apex,https://www.ufc.com/event/ufc-fight-night-february-05-2022,1072
UFC 270: Ngannou vs. Gane,2022-01-23,00:00,['GMT-08:00'],"Anaheim, California, USA",Honda Center,https://www.ufc.com/event/ufc-270,1067
UFC Fight Night: Kattar vs. Chikadze,2022-01-15,22:00,['GMT-08:00'],"Las Vegas, Nevada, USA",UFC Apex,https://www.ufc.com/event/ufc-fight-night-january-15-2022,1068
UFC Fight Night: Lewis vs. Daukaus,2021-12-18,21:00,['GMT-08:00'],"Las Vegas, Nevada, USA",UFC Apex,https://www.ufc.com/event/ufc-fight-night-december-18-2021,1064
UFC 269: Oliveira vs. Poirier,2021-12-11,23:00,['GMT-08:00'],"Las Vegas, Nevada, USA",T-Mobile Arena,https://www.ufc.com/event/ufc-269,1059
UFC Fight Night: Font vs. Aldo,2021-12-05,00:00,['GMT-08:00'],"Las Vegas, Nevada, USA",UFC Apex,https://www.ufc.com/event/ufc-fight-night-december-04-2021,1065
UFC Fight Night: Vieira vs. Tate,2021-11-20,20:00,['GMT-08:00'],"Las Vegas, Nevada, USA",UFC Apex,https://www.ufc.com/event/ufc-fight-night-november-20-2021,1063
UFC Fight Night: Holloway vs. Rodriguez,2021-11-13,18:00,['GMT-08:00'],"Las Vegas, Nevada, USA",UFC Apex,https://www.ufc.com/event/ufc-fight-night-november-13-2021,1062
UFC 268: Usman vs. Covington 2,2021-11-06,22:00,['GMT-04:00'],"New York City, New York, USA",Madison Square Garden,https://www.ufc.com/event/ufc-268,1051
UFC 267: Blachowicz vs. Teixeira,2021-10-30,14:30,['GMT+04:00'],"Abu Dhabi, Abu Dhabi, United Arab Emirates",Etihad Arena,https://www.ufc.com/event/ufc-267,1054
UFC Fight Night: Costa vs. Vettori,2021-10-23,17:00,['GMT-07:00'],"Las Vegas, Nevada, USA",UFC Apex,https://www.ufc.com/event/ufc-fight-night-october-23-2021,1056
UFC Fight Night: Ladd vs. Dumont,2021-10-16,20:30,['GMT-07:00'],"Las Vegas, Nevada, USA",UFC Apex,https://www.ufc.com/event/ufc-fight-night-october-16-2021,1055
UFC Fight Night: Dern vs. Rodriguez,2021-10-09,18:00,['GMT-07:00'],"Las Vegas, Nevada, USA",UFC Apex,https://www.ufc.com/event/ufc-fight-night-october-09-2021,1050
UFC Fight Night: Santos vs. Walker,2021-10-02,20:00,['GMT-07:00'],"Las Vegas, Nevada, USA",UFC Apex,https://www.ufc.com/event/ufc-fight-night-october-02-2021,1049
UFC 266: Volkanovski vs. Ortega,2021-09-25,22:00,['GMT-07:00'],"Las Vegas, Nevada, USA",T-Mobile Arena,https://www.ufc.com/event/ufc-266,1038
UFC Fight Night: Smith vs. Spann,2021-09-18,20:00,['GMT-07:00'],"Las Vegas, Nevada, USA",UFC Apex,https://www.ufc.com/event/ufc-fight-night-september-18-2021,1048
UFC Fight Night: Brunson vs. Till,2021-09-04,18:00,['GMT-07:00'],"Las Vegas, Nevada, USA",UFC Apex,https://www.ufc.com/event/ufc-fight-night-september-04-2021,1046
UFC Fight Night: Barboza vs. Chikadze,2021-08-28,23:00,['GMT-07:00'],"Las Vegas, Nevada, USA",UFC Apex,https://www.ufc.com/event/ufc-fight-night-august-28-2021,1045
UFC Fight Night: Cannonier vs. Gastelum,2021-08-21,23:00,['GMT-07:00'],"Las Vegas, Nevada, USA",UFC Apex,https://www.ufc.com/event/ufc-fight-night-august-21-2021,1039
UFC 265: Lewis vs. Gane,2021-08-07,22:00,['GMT-05:00'],"Houston, Texas, USA",Toyota Center,https://www.ufc.com/event/ufc-265,1037
UFC Fight Night: Hall vs. Strickland,2021-07-31,22:30,['GMT-07:00'],"Las Vegas, Nevada, USA",UFC Apex,https://www.ufc.com/event/ufc-fight-night-july-31-2021,1042
UFC Fight Night: Sandhagen vs. Dillashaw,2021-07-24,20:00,['GMT-07:00'],"Las Vegas, Nevada, USA",UFC Apex,https://www.ufc.com/event/ufc-fight-night-july-24-2021,1041
UFC Fight Night: Makhachev vs. Moises,2021-07-17,23:00,['GMT-07:00'],"Las Vegas, Nevada, USA",UFC Apex,https://www.ufc.com/event/ufc-fight-night-july-17-2021,1040
UFC 264: Poirier vs. McGregor 3,2021-07-10,22:00,['GMT-07:00'],"Las Vegas, Nevada, USA",T-Mobile Arena,https://www.ufc.com/event/ufc-264,1033
UFC Fight Night: Gane vs. Volkov,2021-06-26,17:00,['GMT-07:00'],"Las Vegas, Nevada, USA",UFC Apex,https://www.ufc.com/event/ufc-fight-night-june-26-2021,1032
UFC Fight Night: Jung vs. Ige,2021-06-19,20:00,['GMT-07:00'],"Las Vegas, Nevada, USA",UFC Apex,https://www.ufc.com/event/ufc-fight-night-june-19-2021,1035
UFC 263: Adesanya vs. Vettori 2,2021-06-12,22:00,['GMT-07:00'],"Glendale, Arizona, USA",Gila River Arena,https://www.ufc.com/event/ufc-263,1034
UFC Fight Night: Rozenstruik vs. Sakai,2021-06-05,20:00,['GMT-07:00'],"Las Vegas, Nevada, USA",UFC Apex,https://www.ufc.com/event/ufc-fight-night-june-05-2021,1036
UFC Fight Night: Font vs. Garbrandt,2021-05-22,20:00,['GMT-07:00'],"Las Vegas, Nevada, USA",UFC Apex,https://www.ufc.com/event/ufc-fight-night-may-22-2021,1030
UFC 262: Oliveira vs. Chandler,2021-05-15,22:30,['GMT-05:00'],"Houston, Texas, USA",Toyota Center,https://www.ufc.com/event/ufc-262,1029
UFC Fight Night: Rodriguez vs. Waterson,2021-05-08,22:00,['GMT-07:00'],"Las Vegas, Nevada, USA",UFC Apex,https://www.ufc.com/event/ufc-fight-night-may-08-2021,1028
UFC Fight Night: Reyes vs. Prochazka,2021-05-01,23:00,['GMT-07:00'],"Las Vegas, Nevada, USA",UFC Apex,https://www.ufc.com/event/ufc-fight-night-may-01-2021,1031
UFC 261: Usman vs. Masvidal 2,2021-04-24,22:00,['GMT-04:00'],"Jacksonville, Florida, USA",Vystar Veterans Memorial Arena,https://www.ufc.com/event/ufc-261,1026
UFC Fight Night: Whittaker vs. Gastelum,2021-04-17,23:00,['GMT-07:00'],"Las Vegas, Nevada, USA",UFC Apex,https://www.ufc.com/event/ufc-fight-night-april-17-2021,1025
UFC Fight Night: Vettori vs. Holland,2021-04-10,15:30,['GMT-07:00'],"Las Vegas, Nevada, USA",UFC Apex,https://www.ufc.com/event/ufc-fight-night-april-10-2021,1027
