Event,Date,Start Time,Time Zone,Location,Venue,URL,Event ID
UFC Fight Night: Lewis vs. Hunt,2017-06-10,23:30,['GMT+12:00'],"Auckland, , New Zealand",Spark Arena,https://www.ufc.com/event/ufc-fight-night-auckland-2017,820
UFC 212: Aldo vs. Holloway,2017-06-03,22:30,['GMT-03:00'],"Rio de Janeiro, Rio de Janeiro, Brazil",Farmasi Arena,https://www.ufc.com/event/ufc-212,817
UFC Fight Night: Gustafsson vs. Teixeira,2017-05-28,14:00,['GMT+02:00'],"Stockholm, , Sweden",Ericsson Globe,https://www.ufc.com/event/ufc-fight-night-stockholm-2017,819
UFC 211: Miocic vs. Dos Santos,2017-05-13,22:30,['GMT-05:00'],"Dallas, Texas, USA",American Airlines Center,https://www.ufc.com/event/ufc-211,814
UFC Fight Night: Swanson vs. Lobov,2017-04-22,22:30,['GMT-05:00'],"Nashville, Tennessee, USA",Bridgestone Arena,https://www.ufc.com/event/ufc-fight-night-nashville-2017,815
UFC on FOX: Johnson vs. Reis,2017-04-15,20:00,['GMT-05:00'],"Kansas City, Missouri, USA",T-Mobile Center,https://www.ufc.com/event/ufc-fight-night-kansas-city-2017,816
UFC 210: Cormier vs. Johnson 2,2017-04-08,22:15,['GMT-04:00'],"Buffalo, New York, USA",KeyBank Center,https://www.ufc.com/event/ufc-210,813
UFC Fight Night: Manuwa vs. Anderson,2017-03-18,17:30,['GMT+00:00'],"London, England, United Kingdom",The O2 Arena,https://www.ufc.com/event/ufc-fight-night-london-2017,811
UFC Fight Night: Belfort vs. Gastelum,2017-03-12,00:00,['GMT-03:00'],"Fortaleza, Ceara, Brazil",Centro de Formação Olímpica do Nordeste,https://www.ufc.com/event/ufc-fight-night-brazil-march-2017,810
UFC 209: Woodley vs. Thompson 2,2017-03-05,00:00,['GMT-08:00'],"Las Vegas, Nevada, USA",T-Mobile Arena,https://www.ufc.com/event/ufc-209,809
UFC Fight Night: Lewis vs. Browne,2017-02-19,23:30,['GMT-04:00'],"Halifax, Nova Scotia, Canada",Scotiabank Centre,https://www.ufc.com/event/ufc-fight-night-halifax-2017,808
UFC 208: Holm vs. De Randamie,2017-02-12,00:30,['GMT-05:00'],"Brooklyn, New York, USA",Barclays Center,https://www.ufc.com/event/ufc-208,807
UFC Fight Night: Bermudez vs. The Korean Zombie,2017-02-05,00:00,['GMT-06:00'],"Houston, Texas, USA",Toyota Center,https://www.ufc.com/event/ufc-fight-night-houston-2017,804
UFC on FOX: Shevchenko vs. Pena,2017-01-28,21:00,['GMT-07:00'],"Denver, Colorado, USA",Ball Arena,https://www.ufc.com/event/ufc-fight-night-denver-2017,806
UFC Fight Night: Rodriguez vs. Penn,2017-01-15,23:15,['GMT-07:00'],"Phoenix, Arizona, USA",Footprint Center,https://www.ufc.com/event/ufc-fight-night-phoenix-2016,803
UFC 207: Nunes vs. Rousey,2016-12-31,00:30,['GMT-08:00'],"Las Vegas, Nevada, USA",T-Mobile Arena,https://www.ufc.com/event/ufc-207,802
UFC on FOX: VanZant vs. Waterson,2016-12-17,20:30,['GMT-08:00'],"Sacramento, California, USA",Golden 1 Center,https://www.ufc.com/event/ufc-fight-night-sacramento,801
UFC 206: Holloway vs. Pettis,2016-12-10,23:30,['GMT-05:00'],"Toronto, Ontario, Canada",Scotiabank Arena,https://www.ufc.com/event/ufc-206,800
UFC Fight Night: Lewis vs. Abdurakhimov,2016-12-09,22:45,['GMT-05:00'],"Albany, New York, USA",Times Union Center,https://www.ufc.com/event/ufc-fight-night-albany,799
The Ultimate Fighter: Tournament of Champions Finale,2016-12-04,00:00,['GMT-08:00'],"Las Vegas, Nevada, USA",Pearl Concert Theater,https://www.ufc.com/event/the-ultimate-fighter-24-finale,798
UFC Fight Night: Whittaker vs. Brunson,2016-11-26,23:30,['GMT+11:00'],"Melbourne, Victoria, Australia",Rod Laver Arena,https://www.ufc.com/event/ufc-fight-night-melbourne-2016,797
UFC Fight Night: Mousasi vs. Hall 2,2016-11-19,17:30,['GMT+00:00'],"Belfast, Northern Ireland, United Kingdom",The SSE Arena,https://www.ufc.com/event/ufc-fight-night-belfast,795
UFC Fight Night: Bader vs. Nogueira,2016-11-19,23:00,['GMT-02:00'],"Sao Paulo, Sao Paulo, Brazil",Ginasio do Ibirapuera,https://www.ufc.com/event/ufc-fight-night-brazil-nov-19-2016,796
UFC 205: Alvarez vs McGregor,2016-11-13,00:00,['GMT-05:00'],"New York City, New York, USA",Madison Square Garden,https://www.ufc.com/event/ufc-205,794
UFC Fight Night: Dos Anjos vs. Ferguson,2016-11-05,22:30,['GMT-06:00'],"Mexico City, Distrito Federal, Mexico",Arena CDMX,https://www.ufc.com/event/ufc-fight-night-mexico-city-2016,792
UFC 204: Bisping vs. Henderson,2016-10-08,23:00,['GMT+01:00'],"Manchester, England, United Kingdom",Manchester Arena,https://www.ufc.com/event/ufc-204,793
UFC Fight Night: Lineker vs. Dodson,2016-10-01,23:15,['GMT-07:00'],"Portland, Oregon, USA",Moda Center,https://www.ufc.com/event/ufc-fight-night-portland,790
UFC Fight Night: Cyborg vs. Lansberg,2016-09-24,22:30,['GMT-03:00'],"Brasilia, Distrito Federal, Brazil",Ginasio Nilson Nelson,https://www.ufc.com/event/ufc-fight-night-brasilia-2016,791
UFC Fight Night: Poirier vs. Johnson,2016-09-17,23:00,['GMT-05:00'],"Hidalgo, Texas, USA",State Farm Arena,https://www.ufc.com/event/ufc-fight-night-hidalgo,789
UFC 203: Miocic vs. Overeem,2016-09-10,23:30,['GMT-04:00'],"Cleveland, Ohio, USA",Quicken Loans Arena,https://www.ufc.com/event/ufc-203,784
UFC Fight Night: Arlovski vs. Barnett,2016-09-03,15:45,['GMT+02:00'],"Hamburg, Hamburg, Germany",Barclaycard Arena,https://www.ufc.com/event/ufc-fight-night-hamburg-2016,783
UFC on FOX: Maia vs. Condit,2016-08-27,21:00,['GMT-07:00'],"Vancouver, British Columbia, Canada",Rogers Arena,https://www.ufc.com/event/ufc-fight-night-vancouver-2016,787
UFC 202: Diaz vs. McGregor 2,2016-08-20,22:30,['GMT-07:00'],"Las Vegas, Nevada, USA",T-Mobile Arena,https://www.ufc.com/event/ufc-202,785
UFC Fight Night: Rodriguez vs. Caceres,2016-08-06,23:00,['GMT-06:00'],"Salt Lake City, Utah, USA",Delta Center,https://www.ufc.com/event/ufc-fight-night-salt-lake-city,786
UFC 201: Lawler vs. Woodley,2016-07-30,23:00,['GMT-04:00'],"Atlanta, Georgia, USA",State Farm Arena,https://www.ufc.com/event/ufc-201,782
UFC on FOX: Holm vs. Shevchenko,2016-07-23,20:30,['GMT-05:00'],"Chicago, Illinois, USA",United Center,https://www.ufc.com/event/ufc-fight-night-chicago-2016,779
UFC Fight Night: McDonald vs. Lineker,2016-07-13,22:00,['GMT-05:00'],"Sioux Falls, South Dakota, USA",Denny Sanford Premier Center,https://www.ufc.com/event/ufc-fight-night-sioux-falls,781
UFC 200: Tate vs Nunes,2016-07-09,22:30,['GMT-07:00'],"Las Vegas, Nevada, USA",T-Mobile Arena,https://www.ufc.com/event/ufc-200,778
The Ultimate Fighter: Team Joanna vs. Team Cláudia Finale,2016-07-08,23:00,['GMT-07:00'],"Las Vegas, Nevada, USA",MGM Grand Garden Arena,https://www.ufc.com/event/the-ultimate-fighter-finale-team-joanna-team-claudia,776
UFC Fight Night: Dos Anjos vs. Alvarez,2016-07-07,22:30,['GMT-07:00'],"Las Vegas, Nevada, USA",MGM Grand Garden Arena,https://www.ufc.com/event/ufc-fight-night-las-vegas-july-2016,780
UFC Fight Night: MacDonald vs Thompson,2016-06-18,22:45,['GMT-04:00'],"Ottawa, Ontario, Canada",TD Place Arena,https://www.ufc.com/event/ufc-fight-night-ottawa,775
UFC 199: Rockhold vs. Bisping 2,2016-06-04,22:15,['GMT-07:00'],"Los Angeles, California, USA",The Forum,https://www.ufc.com/event/ufc-199,774
UFC Fight Night: Almeida vs Garbrandt,2016-05-29,22:00,['GMT-07:00'],"Las Vegas, Nevada, USA",Mandalay Bay Events Center,https://www.ufc.com/event/ufc-fight-night-las-vegas-may-2016,777
UFC 198: Werdum vs Miocic,2016-05-14,22:30,['GMT-03:00'],"Curitiba, Parana, Brazil",Arena da Baixada,https://www.ufc.com/event/ufc-198,770
UFC Fight Night: Overeem vs Arlovski,2016-05-08,14:30,['GMT+02:00'],"Rotterdam, Zuid-Holland, Netherlands",Ahoy Rotterdam,https://www.ufc.com/event/ufc-fight-night-rotterdam-2016,773
UFC 197: Jones vs Saint Preux,2016-04-23,22:30,['GMT-07:00'],"Las Vegas, Nevada, USA",MGM Grand Garden Arena,https://www.ufc.com/event/ufc-197,772
UFC on FOX: Teixeira vs Evans,2016-04-16,20:30,['GMT-04:00'],"Tampa, Florida, USA",Amalie Arena,https://www.ufc.com/event/ufc-fight-night-tampa,771
UFC Fight Night: Rothwell vs Dos Santos,2016-04-10,14:30,['GMT+02:00'],"Zagreb, , Croatia",Zagreb Arena,https://www.ufc.com/event/ufc-fight-night-zagreb-2016,769
UFC Fight Night: Hunt vs Mir,2016-03-19,23:00,['GMT+10:00'],"Brisbane, Queensland, Australia",Brisbane Entertainment Centre,https://www.ufc.com/event/ufc-fight-night-brisbane-2016,766
UFC 196: McGregor vs Diaz,2016-03-05,23:30,['GMT-08:00'],"Las Vegas, Nevada, USA",MGM Grand Garden Arena,https://www.ufc.com/event/ufc-196,768
UFC Fight Night: Silva vs Bisping,2016-02-27,17:45,['GMT+00:00'],"London, England, United Kingdom",The O2 Arena,https://www.ufc.com/event/ufc-fight-night-london-2016,763
UFC Fight Night: Cowboy vs Cowboy,2016-02-21,22:30,['GMT-05:00'],"Pittsburgh, Pennsylvania, USA",PPG Paints Arena,https://www.ufc.com/event/ufc-fight-night-pittsburgh-2016,765
UFC Fight Night: Hendricks vs Thompson,2016-02-07,00:00,['GMT-08:00'],"Las Vegas, Nevada, USA",MGM Grand Garden Arena,https://www.ufc.com/event/fight-night-hendricks-vs-thompson,764
UFC on FOX: Johnson vs. Bader,2016-01-30,20:30,['GMT-05:00'],"Newark, New Jersey, USA",Prudential Center,https://www.ufc.com/event/ufc-fight-night-new-jersey,761
UFC Fight Night: Dillashaw vs Cruz,2016-01-17,23:00,['GMT-05:00'],"Boston, Massachusetts, USA",TD Garden,https://www.ufc.com/event/ufc-fight-night-boston-2016,759
UFC 195: Lawler vs Condit,2016-01-02,23:30,['GMT-08:00'],"Las Vegas, Nevada, USA",MGM Grand Garden Arena,https://www.ufc.com/event/ufc-195,754
UFC on FOX: Dos Anjos vs. Cowboy 2,2015-12-19,20:30,['GMT-05:00'],"Orlando, Florida, USA",Amway Center,https://www.ufc.com/event/ufc-fight-night-orlando-2015,750
UFC 194: Aldo vs McGregor,2015-12-12,23:30,['GMT-08:00'],"Las Vegas, Nevada, USA",MGM Grand Garden Arena,https://www.ufc.com/event/ufc-194,753
The Ultimate Fighter: Team McGregor vs. Team Faber Finale,2015-12-12,01:00,['GMT-08:00'],"Las Vegas, Nevada, USA",The Chelsea,https://www.ufc.com/event/the-ultimate-fighter-finale-team-mcgregor-team-faber,756
UFC Fight Night: Namajunas vs. VanZant,2015-12-10,23:45,['GMT-08:00'],"Las Vegas, Nevada, USA",The Chelsea,https://www.ufc.com/event/ufc-fight-night-las-vegas-2015,758
UFC Fight Night: Henderson vs Masvidal,2015-11-28,10:00,['GMT+09:00'],"Seoul, , South Korea",Olympic Park Gymnastics Arena,https://www.ufc.com/event/ufc-fight-night-seoul-south-korea-2015,755
UFC Fight Night: Magny vs Gastelum,2015-11-21,23:30,['GMT-06:00'],"Monterrey, Nuevo Leon, Mexico",Arena Monterrey,https://www.ufc.com/event/ufc-fight-night-monterrey-mexico-2015,746
UFC 193: Rousey vs Holm,2015-11-14,23:15,['GMT+11:00'],"Melbourne, Victoria, Australia",Marvel Stadium,https://www.ufc.com/event/ufc-193,752
UFC Fight Night: Belfort vs Henderson 3,2015-11-07,23:30,['GMT-02:00'],"Sao Paulo, Sao Paulo, Brazil",Ginasio do Ibirapuera,https://www.ufc.com/event/ufc-fight-night-sao-paulo-2015,749
UFC Fight Night: Holohan vs Smolka,2015-10-24,17:15,['GMT+01:00'],"Dublin, Leinster, Ireland",3Arena,https://www.ufc.com/event/ufc-fight-night-dublin-2015,745
UFC 192: Cormier vs Gustafsson,2015-10-03,22:15,['GMT-05:00'],"Houston, Texas, USA",Toyota Center,https://www.ufc.com/event/ufc-192,744
UFC Fight Night: Barnett vs Nelson,2015-09-27,00:00,['GMT+09:00'],"Saitama, , Japan",Saitama Super Arena,https://www.ufc.com/event/ufc-fight-night-140,740
UFC 191: Johnson vs Dodson 2,2015-09-05,23:00,['GMT-07:00'],"Las Vegas, Nevada, USA",MGM Grand Garden Arena,https://www.ufc.com/event/ufc-191,743
UFC Fight Night: Holloway vs Oliveira,2015-08-23,22:00,['GMT-06:00'],"Saskatoon, Saskatchewan, Canada",SaskTel Centre,https://www.ufc.com/event/ufc-fight-night-saskatoon-canada-2015,739
UFC Fight Night: Teixeira vs Saint Preux,2015-08-08,22:30,['GMT-05:00'],"Nashville, Tennessee, USA",Bridgestone Arena,https://www.ufc.com/event/ufc-fight-night-nashville-2015,738
UFC 190: Rousey vs Correia,2015-08-01,23:00,['GMT-03:00'],"Rio de Janeiro, Rio de Janeiro, Brazil",Farmasi Arena,https://www.ufc.com/event/ufc-190,724
UFC on FOX: Dillashaw vs. Barao II,2015-07-25,20:15,['GMT-05:00'],"Chicago, Illinois, USA",United Center,https://www.ufc.com/event/ufc-fight-night-chicago-2015,729
UFC Fight Night: Bisping vs Leites,2015-07-18,14:00,['GMT+01:00'],"Glasgow, Scotland, United Kingdom",The SSE Hydro,https://www.ufc.com/event/ufc-fight-night-glasgow-2015,733
UFC Fight Night: Mir vs Duffee,2015-07-15,23:00,['GMT-07:00'],"San Diego, California, USA",Pechanga Arena,https://www.ufc.com/event/ufc-fight-night-san-diego-2015,727
The Ultimate Fighter: American Top Team vs. Blackzilians Finale,2015-07-12,22:30,['GMT-07:00'],"Las Vegas, Nevada, USA",MGM Grand Garden Arena,https://www.ufc.com/event/the-ultimate-fighter-team-att-team-blackzilians,732
UFC 189: Mendes vs McGregor,2015-07-11,23:00,['GMT-07:00'],"Las Vegas, Nevada, USA",MGM Grand Garden Arena,https://www.ufc.com/event/ufc-189,721
UFC Fight Night: Machida vs Romero,2015-06-28,00:00,['GMT-04:00'],"Hollywood, Florida, USA",Seminole Hard Rock Hotel and Casino,https://www.ufc.com/event/ufc-fight-night-hollywood-florida-2015,731
UFC Fight Night: Jedrzejczyk vs Penne,2015-06-20,16:00,['GMT+02:00'],"Berlin, Berlin, Germany",O2 World,https://www.ufc.com/event/ufc-fight-night-berlin-germany-2015,726
UFC 188: Velasquez vs Werdum,2015-06-13,23:00,['GMT-05:00'],"Mexico City, Distrito Federal, Mexico",Arena CDMX,https://www.ufc.com/event/ufc-188,720
UFC Fight Night: Boetsch vs Henderson,2015-06-06,23:00,['GMT-05:00'],"New Orleans, Louisiana, USA",Smoothie King Center,https://www.ufc.com/event/ufc-fight-night-new-orleans-2015,717
UFC Fight Night: Condit vs Alves,2015-05-30,23:00,['GMT-03:00'],"Goiania, Goias, Brazil",Goiania Arena,https://www.ufc.com/event/ufc-fight-night-goiania-2015,725
UFC 187: Johnson vs Cormier,2015-05-23,22:30,['GMT-07:00'],"Las Vegas, Nevada, USA",MGM Grand Garden Arena,https://www.ufc.com/event/ufc-187,719
UFC Fight Night: Edgar vs Faber,2015-05-16,11:00,['GMT+08:00'],"Manila, , Philippines",Mall of Asia Arena,https://www.ufc.com/event/ufc-fight-night-29,716
UFC Fight Night: Miocic vs Hunt,2015-05-09,23:45,['GMT+09:30'],"Adelaide, South Australia, Australia",Adelaide Entertainment Centre,https://www.ufc.com/event/ufc-fight-night-adelaide-australia-2015,718
UFC 186: Johnson vs Horiguchi,2015-04-25,22:30,['GMT-04:00'],"Montreal, Quebec, Canada",Bell Centre,https://www.ufc.com/event/ufc-186,711
UFC on FOX: Machida vs Rockhold,2015-04-18,20:30,['GMT-04:00'],"Newark, New Jersey, USA",Prudential Center,https://www.ufc.com/event/ufc-fight-night-newark-new-jersey,706
UFC Fight Night: Gonzaga vs Cro Cop 2,2015-04-11,15:45,['GMT+02:00'],"Krakow, , Poland",Tauron Arena,https://www.ufc.com/event/ufc-fight-night-krakow-poland-2015,714
UFC Fight Night: Mendes vs Lamas,2015-04-04,15:00,['GMT-04:00'],"Fairfax, Virginia, USA",EagleBank Arena,https://www.ufc.com/event/ufc-fight-night-fairfax-2015,712
UFC Fight Night: Maia vs LaFlare,2015-03-21,23:00,['GMT-03:00'],"Rio de Janeiro, , Brazil",Ginasio do Maracanazinho,https://www.ufc.com/event/ufc-fight-night-rio-de-janeiro-2015,713
UFC 185: Pettis vs Dos Anjos,2015-03-14,22:30,['GMT-05:00'],"Dallas, Texas, USA",American Airlines Center,https://www.ufc.com/event/ufc-185,704
UFC 184: Rousey vs Zingano,2015-03-01,00:00,['GMT-08:00'],"Los Angeles, California, USA",Staples Center,https://www.ufc.com/event/ufc-184,700
UFC Fight Night: Bigfoot vs Mir,2015-02-22,22:00,['GMT-03:00'],"Porto Alegre, Rio Grande do Sul, Brazil",Ginasio Gigantinho,https://www.ufc.com/event/ufc-fight-night-porto-alegre,703
UFC Fight Night: Henderson vs Thatch,2015-02-15,01:00,['GMT-07:00'],"Broomfield, Colorado, USA",1stBank Center,https://www.ufc.com/event/ufc-fight-night-broomfield,701
UFC 183: Silva vs Diaz,2015-01-31,23:30,['GMT-08:00'],"Las Vegas, Nevada, USA",MGM Grand Garden Arena,https://www.ufc.com/event/ufc-183,699
UFC on FOX: Gustafsson vs Johnson,2015-01-24,21:00,['GMT+01:00'],"Stockholm, , Sweden",Tele2 Arena,https://www.ufc.com/event/ufc-fight-night-stockholm-sweden,702
UFC Fight Night: McGregor vs Siver,2015-01-18,22:00,['GMT-05:00'],"Boston, Massachusetts, USA",TD Garden,https://www.ufc.com/event/ufc-fight-night-boston-2015,698
UFC 182: Jones vs Cormier,2015-01-04,00:00,['GMT-08:00'],"Las Vegas, Nevada, USA",MGM Grand Garden Arena,https://www.ufc.com/event/ufc-182,691
UFC Fight Night: Machida vs Dollaway,2014-12-21,00:00,['GMT-02:00'],"Barueri, Sao Paulo, Brazil",Ginasio Jose Correa,https://www.ufc.com/event/ufc-fight-night-barueri,696
UFC on FOX: Dos Santos vs Miocic,2014-12-13,20:30,['GMT-07:00'],"Phoenix, Arizona, USA",Footprint Center,https://www.ufc.com/event/ufc-fight-night-phoenix,695
The Ultimate Fighter: A Champion Will Be Crowned Finale,2014-12-12,23:00,['GMT-08:00'],"Las Vegas, Nevada, USA",Pearl Concert Theater,https://www.ufc.com/event/the-ultimate-fighter-a-champion-will-be-crowned,697
UFC 181: Hendricks vs Lawler II,2014-12-07,00:00,['GMT-08:00'],"Las Vegas, Nevada, USA",Mandalay Bay Events Center,https://www.ufc.com/event/ufc-181,690
UFC Fight Night: Edgar vs Swanson,2014-11-23,00:00,['GMT-06:00'],"Austin, Texas, USA",Frank Erwin Center,https://www.ufc.com/event/ufc-fight-night-austin,692
UFC 180: Werdum vs Hunt,2014-11-16,00:00,['GMT-06:00'],"Mexico City, Distrito Federal, Mexico",Arena CDMX,https://www.ufc.com/event/ufc-180,689
UFC Fight Night 56: Shogun vs Saint Preux,2014-11-09,01:00,['GMT-02:00'],"Uberlandia, Minas Gerais, Brazil",Ginasio Municipal Tancredo Neves,https://www.ufc.com/event/ufc-fight-night-uberlandia,693
UFC Fight Night: Rockhold vs Bisping,2014-11-08,00:00,['GMT+11:00'],"Sydney, New South Wales, Australia",Qudos Bank Arena,https://www.ufc.com/event/ufc-fight-night-sydney-australia,694
UFC 179: Aldo vs Mendes 2,2014-10-25,23:00,['GMT-02:00'],"Rio de Janeiro, , Brazil",Ginasio do Maracanazinho,https://www.ufc.com/event/ufc-179,687
UFC Fight Night: MacDonald vs Saffiedine,2014-10-04,23:00,['GMT-03:00'],"Halifax, Nova Scotia, Canada",Scotiabank Centre,https://www.ufc.com/event/ufc-fight-night-halifax,688
UFC Fight Night: Nelson vs Story,2014-10-04,16:10,['GMT+02:00'],"Stockholm, , Sweden",Ericsson Globe,https://www.ufc.com/event/ufc-fight-night-stockholm,686
UFC 178: Johnson vs Cariaso,2014-09-27,23:00,['GMT-07:00'],"Las Vegas, Nevada, USA",MGM Grand Garden Arena,https://www.ufc.com/event/ufc-178,684
UFC Fight Night: Hunt vs Nelson,2014-09-20,04:30,['GMT+09:00'],"Saitama, , Japan",Saitama Super Arena,https://www.ufc.com/event/ufc-fight-night-127,680
UFC Fight Night: Bigfoot vs Arlovski,2014-09-13,21:45,['GMT-03:00'],"Brasilia, Distrito Federal, Brazil",Ginasio Nilson Nelson,https://www.ufc.com/event/ufc-fight-night-brasilia,685
UFC Fight Night: Jacare vs Mousasi,2014-09-05,23:00,['GMT-04:00'],"Ledyard, Connecticut, USA",Foxwoods Resort Casino,https://www.ufc.com/event/ufc-fight-night-ledyard,683
UFC 177: Dillashaw vs Soto,2014-08-30,23:30,['GMT-07:00'],"Sacramento, California, USA",Sleep Train Arena,https://www.ufc.com/event/ufc-177,677
UFC Fight Night: Bisping vs Le,2014-08-23,10:30,['GMT+08:00'],"Macau, , China",Cotai Arena,https://www.ufc.com/event/ufc-fight-night-macao-cotai-arena,679
UFC Fight Night: Henderson vs Dos Anjos,2014-08-23,23:30,['GMT-05:00'],"Tulsa, Oklahoma, USA",BOK Center,https://www.ufc.com/event/ufc-fight-night-bok-center-tulsa,682
UFC Fight Night: Bader vs Saint Preux,2014-08-17,00:00,['GMT-04:00'],"Bangor, Maine, USA",Cross Insurance Center,https://www.ufc.com/event/ufc-fight-night-125,681
UFC on FOX: Lawler vs Brown,2014-07-26,20:15,['GMT-07:00'],"San Jose, California, USA",San Jose Civic Auditorium,https://www.ufc.com/event/FOX12,678
UFC Fight Night: McGregor vs Brandao,2014-07-19,16:30,['GMT+01:00'],"Dublin, Leinster, Ireland",3Arena,https://www.ufc.com/event/ufn-dublin-ireland,675
UFC Fight Night: Cowboy vs Miller,2014-07-16,22:30,['GMT-04:00'],"Atlantic City, New Jersey, USA",Revel Resort,https://www.ufc.com/event/ufc-fight-night-atlantic-city,676
The Ultimate Fighter: Team Edgar vs. Team Penn Finale,2014-07-06,22:00,['GMT-07:00'],"Las Vegas, Nevada, USA",Mandalay Bay Events Center,https://www.ufc.com/event/TUF19-Finale,671
UFC 175: Weidman vs Machida,2014-07-05,23:00,['GMT-07:00'],"Las Vegas, Nevada, USA",Mandalay Bay Events Center,https://www.ufc.com/event/ufc-175,673
UFC Fight Night: Swanson vs Stephens,2014-06-28,23:30,['GMT-05:00'],"San Antonio, Texas, USA",AT&T Center,https://www.ufc.com/event/ufn-san-antonio-fs1,670
UFC Fight Night: Te Huna vs Marquardt,2014-06-28,06:30,['GMT+12:00'],"Auckland, , New Zealand",Spark Arena,https://www.ufc.com/event/ufn-auckland-nz,674
UFC 174: Johnson vs Bagautinov,2014-06-14,23:00,['GMT-07:00'],"Vancouver, British Columbia, Canada",Rogers Arena,https://www.ufc.com/event/ufc-174,669
UFC Fight Night: Henderson vs Khabilov,2014-06-07,23:30,['GMT-06:00'],"Albuquerque, New Mexico, USA",Tingley Coliseum,https://www.ufc.com/event/ufn-albuquerque-fs1,668
UFC Fight Night: Miocic vs Maldonado,2014-05-31,22:30,['GMT-03:00'],"Sao Paulo, , Brazil",Ginasio do Ibirapuera,https://www.ufc.com/event/ufn-sao-paulo-tuf-brazil,666
UFC Fight Night: Munoz vs Mousasi,2014-05-31,16:30,['GMT+02:00'],"Berlin, , Germany",O2 World,https://www.ufc.com/event/fight-night-berlin,672
UFC 173: Barao vs Dillashaw,2014-05-24,22:30,['GMT-07:00'],"Las Vegas, Nevada, USA",MGM Grand Garden Arena,https://www.ufc.com/event/ufc-173,664
UFC Fight Night: Brown vs Silva,2014-05-10,22:30,['GMT-04:00'],"Cincinnati, Ohio, USA",U.S. Bank Arena,https://www.ufc.com/event/ufn-cincinnati-fs1,667
UFC 172: Jones vs Teixeira,2014-04-26,23:30,['GMT-04:00'],"Baltimore, Maryland, USA",Royal Farms Arena,https://www.ufc.com/event/ufc-172,660
UFC on FOX: Werdum vs Browne,2014-04-19,19:30,['GMT-04:00'],"Orlando, Florida, USA",Amway Center,https://www.ufc.com/event/FOX11,661
UFC Fight Night: Bisping vs Kennedy,2014-04-16,19:15,['GMT-04:00'],"Quebec City, Quebec, Canada",Colisee Pepsi,https://www.ufc.com/event/ufc-fight-night-quebec-city,663
UFC Fight Night: Minotauro vs Nelson,2014-04-11,16:15,['GMT+04:00'],"Abu Dhabi, , United Arab Emirates",du Arena,https://www.ufc.com/event/ufc-abu-dhabi-nogueira-nelson,665
UFC Fight Night: Shogun vs Henderson 2,2014-03-23,20:00,['GMT-03:00'],"Natal, Rio Grande do Norte, Brazil",Ginasio Nelio Dias,https://www.ufc.com/event/ufn-natal-brazil,662
UFC 171: Hendricks vs Lawler,2014-03-15,22:00,['GMT-05:00'],"Dallas, Texas, USA",American Airlines Center,https://www.ufc.com/event/ufc-171,653
UFC Fight Night: Gustafsson vs Manuwa,2014-03-08,17:30,['GMT+00:00'],"London, England, United Kingdom",The O2 Arena,https://www.ufc.com/event/ufc-london,649
UFC Fight Night: Kim vs Hathaway,2014-03-01,11:20,['GMT+08:00'],"Macau, , China",Cotai Arena,https://www.ufc.com/event/ufn-macao-kim-hathaway,655
UFC 170: Rousey vs McMann,2014-02-23,00:00,['GMT-08:00'],"Las Vegas, Nevada, USA",Mandalay Bay Events Center,https://www.ufc.com/event/ufc-170,650
UFC Fight Night: Machida vs Mousasi,2014-02-16,00:30,['GMT-02:00'],"Jaragua do Sul, Santa Catarina, Brazil",Arena Jaragua,https://www.ufc.com/event/ufn-jaragua-do-sul,647
UFC 169: Barao vs Faber 2,2014-02-01,23:30,['GMT-05:00'],"Newark, New Jersey, USA",Prudential Center,https://www.ufc.com/event/ufc-169,646
UFC on FOX: Henderson vs Thomson,2014-01-25,21:30,['GMT-06:00'],"Chicago, Illinois, USA",United Center,https://www.ufc.com/event/FOX10,652
UFC Fight Night: Rockhold vs Philippou,2014-01-15,21:00,['GMT-05:00'],"Duluth, Georgia, USA",Arena at Gwinett Center,https://www.ufc.com/event/ufc-fight-night-atlanta,651
UFC Fight Night: Saffiedine vs Lim,2014-01-04,11:30,['GMT+08:00'],"Singapore, , Singapore",Marina Bay Sands,https://www.ufc.com/event/ufn-singapore,648
UFC 168: Weidman vs Silva 2,2013-12-29,00:00,['GMT-08:00'],"Las Vegas, Nevada, USA",MGM Grand Garden Arena,https://www.ufc.com/event/ufc-168,638
UFC on FOX: Johnson vs. Benavidez 2,2013-12-14,21:00,['GMT-08:00'],"Sacramento, California, USA",Sleep Train Arena,https://www.ufc.com/event/FOX9,645
UFC Fight Night: Hunt vs Bigfoot,2013-12-06,23:30,['GMT+10:00'],"Brisbane, Queensland, Australia",Queensland Entertainment Centre,https://www.ufc.com/event/ufc-fight-night-hunt-bigfoot,644
The Ultimate Fighter: Team Rousey vs. Team Tate Finale,2013-12-01,00:30,['GMT-08:00'],"Las Vegas, Nevada, USA",Mandalay Bay Events Center,https://www.ufc.com/event/TUF18-Finale,643
UFC 167: St-Pierre vs Hendricks,2013-11-16,23:30,['GMT-08:00'],"Las Vegas, Nevada, USA",MGM Grand Garden Arena,https://www.ufc.com/event/ufc-167,637
UFC Fight Night: Belfort vs Henderson 2,2013-11-09,22:30,['GMT-02:00'],"Goiania, Goias, Brazil",Goiania Arena,https://www.ufc.com/event/ufn-belfort-henderson,642
UFC Fight Night: Fight for the Troops 3,2013-11-06,20:10,['GMT-06:00'],"Fort Campbell, Kentucky, USA",Fort Campbell,https://www.ufc.com/event/ufc-fight-night-fftt-fort-campbell,640
UFC Fight Night: Machida vs Munoz,2013-10-26,16:00,['GMT+01:00'],"Manchester, England, United Kingdom",Manchester Arena,https://www.ufc.com/event/ufc-fight-night-machida-munoz,639
UFC 166: Velasquez vs Dos Santos 3,2013-10-19,22:15,['GMT-05:00'],"Houston, Texas, USA",Toyota Center,https://www.ufc.com/event/ufc-166,636
UFC Fight Night: Maia vs Shields,2013-10-09,21:00,['GMT-03:00'],"Barueri, Sao Paulo, Brazil",Ginasio Jose Correa,https://www.ufc.com/event/ufc-fight-night-maia-shields,641
UFC 165: Jones vs Gustafsson,2013-09-21,22:15,['GMT-04:00'],"Toronto, Ontario, Canada",Scotiabank Arena,https://www.ufc.com/event/ufc-165,634
UFC Fight Night: Teixeira vs Bader,2013-09-04,20:30,['GMT-03:00'],"Belo Horizonte, Minas Gerais, Brazil",Mineirinho Arena,https://www.ufc.com/event/ufc-fight-night-teixeira-bader,635
UFC 164: Henderson vs Pettis 2,2013-08-31,22:30,['GMT-05:00'],"Milwaukee, Wisconsin, USA",Bradley Center,https://www.ufc.com/event/ufc-164,631
UFC Fight Night: Condit vs Kampmann 2,2013-08-28,21:00,['GMT-04:00'],"Indianapolis, Indiana, USA",Bankers Life Fieldhouse,https://www.ufc.com/event/ufc-fight-night-condit-kampmann2,633
UFC Fight Night: Shogun vs Sonnen,2013-08-17,20:30,['GMT-04:00'],"Boston, Massachusetts, USA",TD Garden,https://www.ufc.com/event/ufc-fight-night-shogun-sonnen,632
UFC 163: Aldo vs Jung,2013-08-03,22:30,['GMT-03:00'],"Rio de Janeiro, , Brazil",Farmasi Arena,https://www.ufc.com/event/ufc-163,630
