Event,Date,Start Time,Time Zone,Location,Venue,URL,Event ID
UFC 260: Miocic vs. Ngannou,2021-03-27,23:30,['GMT-07:00'],"Las Vegas, Nevada, USA",UFC Apex,https://www.ufc.com/event/ufc-260,1022
UFC Fight Night: Brunson vs. Holland,2021-03-20,23:30,['GMT-07:00'],"Las Vegas, Nevada, USA",UFC Apex,https://www.ufc.com/event/ufc-fight-night-march-20-2021,1024
UFC Fight Night: Edwards vs. Muhammad,2021-03-13,22:00,['GMT-08:00'],"Las Vegas, Nevada, USA",UFC Apex,https://www.ufc.com/event/ufc-fight-night-march-13-2021,1023
UFC 259: Blachowicz vs. Adesanya,2021-03-06,22:15,['GMT-08:00'],"Las Vegas, Nevada, USA",UFC Apex,https://www.ufc.com/event/ufc-259,1021
UFC Fight Night: Rozenstruik vs. Gane,2021-02-27,23:00,['GMT-08:00'],"Las Vegas, Nevada, USA",UFC Apex,https://www.ufc.com/event/ufc-fight-night-february-27-2021,1020
UFC Fight Night: Blaydes vs. Lewis,2021-02-20,22:00,['GMT-08:00'],"Las Vegas, Nevada, USA",UFC Apex,https://www.ufc.com/event/ufc-fight-night-february-20-2021,1019
UFC 258: Usman vs. Burns,2021-02-14,00:00,['GMT-08:00'],"Las Vegas, Nevada, USA",UFC Apex,https://www.ufc.com/event/ufc-258,1015
UFC Fight Night: Overeem vs. Volkov,2021-02-06,22:00,['GMT-08:00'],"Las Vegas, Nevada, USA",UFC Apex,https://www.ufc.com/event/ufc-fight-night-february-6-2021,1018
UFC 257: Poirier vs. McGregor,2021-01-24,00:00,['GMT+04:00'],"Abu Dhabi, Abu Dhabi, United Arab Emirates",Etihad Arena,https://www.ufc.com/event/ufc-257,1016
UFC Fight Night: Chiesa vs. Magny,2021-01-20,14:00,['GMT+04:00'],"Abu Dhabi, Abu Dhabi, United Arab Emirates",Etihad Arena,https://www.ufc.com/event/ufc-fight-night-january-20-2021,1017
UFC Fight Night: Holloway vs. Kattar,2021-01-16,17:00,['GMT+04:00'],"Abu Dhabi, Abu Dhabi, United Arab Emirates",Etihad Arena,https://www.ufc.com/event/ufc-fight-night-january-16-2021,1014
UFC Fight Night: Thompson vs. Neal,2020-12-19,21:00,['GMT-08:00'],"Las Vegas, Nevada, USA",UFC Apex,https://www.ufc.com/event/ufc-fight-night-december-19-2020,1013
UFC 256: Figueiredo vs. Moreno,2020-12-13,00:30,['GMT-08:00'],"Las Vegas, Nevada, USA",UFC Apex,https://www.ufc.com/event/ufc-256,1012
UFC Fight Night: Hermansson vs. Vettori,2020-12-06,01:00,['GMT-08:00'],"Las Vegas, Nevada, USA",UFC Apex,https://www.ufc.com/event/ufc-fight-night-december-05-2020,1011
UFC Fight Night: Smith vs. Clark,2020-11-29,01:00,['GMT-08:00'],"Las Vegas, Nevada, USA",UFC Apex,https://www.ufc.com/event/ufc-fight-night-november-28-2020,1010
UFC 255: Figueiredo vs. Perez,2020-11-21,23:30,['GMT-08:00'],"Las Vegas, Nevada, USA",UFC Apex,https://www.ufc.com/event/ufc-255,1003
UFC Fight Night: Felder vs. Dos Anjos,2020-11-14,22:00,['GMT-08:00'],"Las Vegas, Nevada, USA",UFC Apex,https://www.ufc.com/event/ufc-fight-night-november-14-2020,1009
UFC Fight Night: Santos vs. Teixeira,2020-11-08,00:30,['GMT-08:00'],"Las Vegas, Nevada, USA",UFC Apex,https://www.ufc.com/event/ufc-fight-night-november-07-2020,1008
UFC Fight Night: Hall vs. Silva,2020-10-31,20:00,['GMT-07:00'],"Las Vegas, Nevada, USA",UFC Apex,https://www.ufc.com/event/ufc-fight-night-october-31-2020,1004
UFC 254: Khabib vs. Gaethje,2020-10-24,15:00,['GMT+04:00'],"Abu Dhabi, Abu Dhabi, United Arab Emirates",Flash Forum,https://www.ufc.com/event/ufc-254,988
UFC Fight Night: Ortega vs. The Korean Zombie,2020-10-17,20:00,['GMT+04:00'],"Abu Dhabi, Abu Dhabi, United Arab Emirates",Flash Forum,https://www.ufc.com/event/ufc-fight-night-october-17-2020,1001
UFC Fight Night: Moraes vs. Sandhagen,2020-10-10,21:00,['GMT+04:00'],"Abu Dhabi, Abu Dhabi, United Arab Emirates",Flash Forum,https://www.ufc.com/event/ufc-fight-night-october-10-2020,1002
UFC Fight Night: Holm vs. Aldana,2020-10-03,23:30,['GMT+04:00'],"Abu Dhabi, Abu Dhabi, United Arab Emirates",Flash Forum,https://www.ufc.com/event/ufc-fight-night-october-03-2020,994
UFC 253: Adesanya vs. Costa,2020-09-26,23:00,['GMT+04:00'],"Abu Dhabi, Abu Dhabi, United Arab Emirates",Flash Forum,https://www.ufc.com/event/ufc-253,992
UFC Fight Night: Covington vs. Woodley,2020-09-19,21:00,['GMT-07:00'],"Las Vegas, Nevada, USA",UFC Apex,https://www.ufc.com/event/ufc-fight-night-september-19-2020,997
UFC Fight Night: Waterson vs. Hill,2020-09-12,21:00,['GMT-07:00'],"Las Vegas, Nevada, USA",UFC Apex,https://www.ufc.com/event/ufc-fight-night-september-12-2020,996
UFC Fight Night: Overeem vs. Sakai,2020-09-05,23:00,['GMT-07:00'],"Las Vegas, Nevada, USA",UFC Apex,https://www.ufc.com/event/ufc-fight-night-sept-05-2020,995
UFC Fight Night: Smith vs. Rakic,2020-08-29,22:00,['GMT-07:00'],"Las Vegas, Nevada, USA",UFC Apex,https://www.ufc.com/event/ufc-fight-night-august-29-2020,993
UFC Fight Night: Munhoz vs. Edgar,2020-08-22,22:30,['GMT-07:00'],"Las Vegas, Nevada, USA",UFC Apex,https://www.ufc.com/event/ufc-fight-night-august-22-2020,989
UFC 252: Miocic vs. Cormier 3,2020-08-15,23:00,['GMT-07:00'],"Las Vegas, Nevada, USA",UFC Apex,https://www.ufc.com/event/ufc-252,970
UFC Fight Night: Lewis vs. Oleinik,2020-08-08,22:00,['GMT-07:00'],"Las Vegas, Nevada, USA",UFC Apex,https://www.ufc.com/event/ufc-fight-night-august-08-2020,987
UFC Fight Night: Brunson vs. Shahbazyan,2020-08-01,23:00,['GMT-07:00'],"Las Vegas, Nevada, USA",UFC Apex,https://www.ufc.com/event/ufc-fight-night-august-01-2020,984
UFC Fight Night: Whittaker vs. Till,2020-07-25,21:00,['GMT+04:00'],"Abu Dhabi, Abu Dhabi, United Arab Emirates",Flash Forum,https://www.ufc.com/event/ufc-fight-night-july-25-2020,983
UFC Fight Night: Figueiredo vs. Benavidez 2,2020-07-18,21:00,['GMT+04:00'],"Abu Dhabi, Abu Dhabi, United Arab Emirates",Flash Forum,https://www.ufc.com/event/ufc-fight-night-july-18-2020,982
UFC Fight Night: Kattar vs. Ige,2020-07-15,23:00,['GMT+04:00'],"Abu Dhabi, Abu Dhabi, United Arab Emirates",Flash Forum,https://www.ufc.com/event/ufc-fight-night-july-15-2020,981
UFC 251: Usman vs. Masvidal,2020-07-11,22:00,['GMT+04:00'],"Abu Dhabi, Abu Dhabi, United Arab Emirates",Flash Forum,https://www.ufc.com/event/ufc-251,974
UFC Fight Night: Poirier vs. Hooker,2020-06-27,22:00,['GMT-07:00'],"Las Vegas, Nevada, USA",UFC Apex,https://www.ufc.com/event/ufc-fight-night-june-27-2020,976
UFC Fight Night: Blaydes vs. Volkov,2020-06-20,21:00,['GMT-07:00'],"Las Vegas, Nevada, USA",UFC Apex,https://www.ufc.com/event/ufc-fight-night-2020,980
UFC Fight Night: Eye vs. Calvillo,2020-06-13,23:00,['GMT-07:00'],"Las Vegas, Nevada, USA",UFC Apex,https://www.ufc.com/event/ufc-fight-night-june-13-2020,973
UFC 250: Nunes vs. Spencer,2020-06-06,22:00,['GMT-07:00'],"Las Vegas, Nevada, USA",UFC Apex,https://www.ufc.com/event/ufc-250,971
UFC Fight Night: Woodley vs. Burns,2020-05-30,22:00,['GMT-07:00'],"Las Vegas, Nevada, USA",UFC Apex,https://www.ufc.com/event/ufc-fight-night-may-30-2020,979
UFC Fight Night: Overeem vs. Harris,2020-05-16,22:00,['GMT-04:00'],"Jacksonville, Florida, USA",Vystar Veterans Memorial Arena,https://www.ufc.com/event/ufc-fight-night-may-16-2020,978
UFC Fight Night: Smith vs. Teixeira,2020-05-13,22:00,['GMT-04:00'],"Jacksonville, Florida, USA",Vystar Veterans Memorial Arena,https://www.ufc.com/event/ufc-fight-night-may-13-2020,977
UFC 249: Ferguson vs. Gaethje,2020-05-09,22:30,['GMT-04:00'],"Jacksonville, Florida, USA",Vystar Veterans Memorial Arena,https://www.ufc.com/event/ufc-249,975
UFC Fight Night: Lee vs. Oliveira,2020-03-14,19:00,['GMT-03:00'],"Brasilia, Distrito Federal, Brazil",Ginasio Nilson Nelson,https://www.ufc.com/event/ufc-fight-night-march-14-2020,966
UFC 248: Adesanya vs. Romero,2020-03-08,00:00,['GMT-08:00'],"Las Vegas, Nevada, USA",T-Mobile Arena,https://www.ufc.com/event/ufc-248,964
UFC Fight Night: Benavidez vs. Figueiredo,2020-02-29,22:00,['GMT-05:00'],"Norfolk, Virginia, USA",Chartway Arena,https://www.ufc.com/event/ufc-fight-night-norfolk-february-29-2020,961
UFC Fight Night: Felder vs. Hooker,2020-02-22,21:00,['GMT+13:00'],"Auckland, , New Zealand",Spark Arena,https://www.ufc.com/event/ufc-fight-night-february-23-2020,957
UFC Fight Night: Anderson vs. Blachowicz,2020-02-15,22:00,['GMT-07:00'],"Rio Rancho, New Mexico, USA",Santa Ana Star Center,https://www.ufc.com/event/ufc-fight-night-february-15-2020,960
UFC 247: Jones vs. Reyes,2020-02-08,23:30,['GMT-06:00'],"Houston, Texas, USA",Toyota Center,https://www.ufc.com/event/ufc-247,958
UFC Fight Night: Blaydes vs. Dos Santos,2020-01-25,22:00,['GMT-05:00'],"Raleigh, North Carolina, USA",PNC Arena,https://www.ufc.com/event/ufc-fight-night-raleigh-january-25-blaydes-jds,956
UFC 246: McGregor vs. Cowboy,2020-01-19,00:00,['GMT-08:00'],"Las Vegas, Nevada, USA",T-Mobile Arena,https://www.ufc.com/event/ufc-246,963
UFC Fight Night: Edgar vs. The Korean Zombie,2019-12-21,07:00,['GMT+09:00'],"Busan, , South Korea",Sajik Arena,https://www.ufc.com/event/ufc-fight-night-december-21-2019,955
UFC 245: Usman vs. Covington,2019-12-14,23:15,['GMT-08:00'],"Las Vegas, Nevada, USA",T-Mobile Arena,https://www.ufc.com/event/ufc-245,953
UFC Fight Night: Overeem vs. Rozenstruik,2019-12-07,22:45,['GMT-05:00'],"Washington, DC, USA",Capital One Arena,https://www.ufc.com/event/ufc-fight-night-december-7-2019,950
UFC Fight Night: Blachowicz vs. Jacare,2019-11-16,22:00,['GMT-03:00'],"Sao Paulo, Sao Paulo, Brazil",Ginasio do Ibirapuera,https://www.ufc.com/event/ufc-fight-night-november-16-2019,954
UFC Fight Night: Zabit vs. Kattar,2019-11-09,16:00,['GMT+03:00'],"Moscow, Moscow, Russia",CSKA Arena,https://www.ufc.com/event/ufc-fight-night-november-9-2019,952
UFC 244: Masvidal vs. Diaz,2019-11-02,22:30,['GMT-04:00'],"New York City, New York, USA",Madison Square Garden,https://www.ufc.com/event/ufc-244,949
UFC Fight Night: Maia vs. Askren,2019-10-26,09:30,['GMT+08:00'],"Kallang, , Singapore",Singapore Indoor Stadium,https://www.ufc.com/event/ufc-fight-night-october-26-2019,951
UFC Fight Night: Reyes vs. Weidman,2019-10-18,22:00,['GMT-04:00'],"Boston, Massachusetts, USA",TD Garden,https://www.ufc.com/event/ufc-fight-night-october-18-2019,948
UFC Fight Night: Joanna vs. Waterson,2019-10-12,21:00,['GMT-04:00'],"Tampa, Florida, USA",Amalie Arena,https://www.ufc.com/event/ufc-fight-night-october-12-2019,947
UFC 243: Whittaker vs. Adesanya,2019-10-05,22:45,['GMT+11:00'],"Melbourne, Victoria, Australia",Marvel Stadium,https://www.ufc.com/event/ufc-243,946
UFC Fight Night: Hermansson vs. Cannonier,2019-09-28,15:00,['GMT+02:00'],"Copenhagen, , Denmark",Royal Arena,https://www.ufc.com/event/ufc-fight-night-september-28-2019,945
UFC Fight Night: Rodriguez vs. Stephens,2019-09-21,21:00,['GMT-05:00'],"Mexico City, Distrito Federal, Mexico",Arena CDMX,https://www.ufc.com/event/ufc-fight-night-septemer-21-2019,944
UFC Fight Night: Cowboy vs. Gaethje,2019-09-14,21:00,['GMT-07:00'],"Vancouver, British Columbia, Canada",Rogers Arena,https://www.ufc.com/event/ufc-fight-night-september-14-2019,940
UFC 242: Khabib vs. Poirier,2019-09-07,14:15,['GMT+04:00'],"Abu Dhabi, Abu Dhabi, United Arab Emirates",The Arena,https://www.ufc.com/event/ufc-242,936
UFC Fight Night: Andrade vs. Zhang,2019-08-31,07:00,['GMT+08:00'],"Shenzhen, Guangdong, China",Shenzhen Universiade Sports Centre,https://www.ufc.com/event/ufc-fight-night-august-31-2019,938
UFC 241: Cormier vs. Miocic 2,2019-08-17,22:30,['GMT-07:00'],"Anaheim, California, USA",Honda Center,https://www.ufc.com/event/ufc-241,926
UFC Fight Night: Shevchenko vs. Carmouche 2,2019-08-10,21:00,['GMT-03:00'],"Montevideo, , Uruguay",Antel Arena,https://www.ufc.com/event/ufc-fight-night-august-10-2019,937
UFC Fight Night: Covington vs. Lawler,2019-08-03,16:00,['GMT-04:00'],"Newark, New Jersey, USA",Prudential Center,https://www.ufc.com/event/ufc-fight-night-august-03-2019,939
UFC 240: Holloway vs. Edgar,2019-07-27,23:00,['GMT-06:00'],"Edmonton, Alberta, Canada",Rogers Place,https://www.ufc.com/event/ufc-240,935
UFC Fight Night: Dos Anjos vs. Edwards,2019-07-20,22:00,['GMT-05:00'],"San Antonio, Texas, USA",AT&T Center,https://www.ufc.com/event/ufc-fight-night-july-20-2019,930
UFC Fight Night: De Randamie vs. Ladd,2019-07-13,21:00,['GMT-07:00'],"Sacramento, California, USA",Golden 1 Center,https://www.ufc.com/event/ufc-fight-night-july-13-2019,925
UFC 239: Jones vs. Santos,2019-07-06,22:15,['GMT-07:00'],"Las Vegas, Nevada, USA",T-Mobile Arena,https://www.ufc.com/event/ufc-239,924
UFC Fight Night: Ngannou vs. Dos Santos,2019-06-29,22:00,['GMT-05:00'],"Minneapolis, Minnesota, USA",Target Center,https://www.ufc.com/event/ufc-fight-night-june-29-2019-minneapolis,923
UFC Fight Night: Moicano vs. The Korean Zombie,2019-06-22,20:00,['GMT-04:00'],"Greenville, South Carolina, USA",Bon Secours Wellness Arena,https://www.ufc.com/event/ufc-fight-night-june-22-2019,922
UFC 238: Cejudo vs. Moraes,2019-06-08,22:15,['GMT-05:00'],"Chicago, Illinois, USA",United Center,https://www.ufc.com/event/ufc-238,919
UFC Fight Night: Gustafsson vs. Smith,2019-06-01,14:00,['GMT+02:00'],"Stockholm, , Sweden",Ericsson Globe,https://www.ufc.com/event/ufc-fight-night-stockholm-2019,921
UFC Fight Night: Dos Anjos vs. Lee,2019-05-18,21:00,['GMT-04:00'],"Rochester, New York, USA",Blue Cross Arena,https://www.ufc.com/event/ufc-fight-night-may-18-2019,920
UFC 237: Namajunas vs. Andrade,2019-05-11,22:30,['GMT-03:00'],"Rio de Janeiro, Rio de Janeiro, Brazil",Farmasi Arena,https://www.ufc.com/event/ufc-237,918
UFC Fight Night: Iaquinta vs. Cowboy,2019-05-04,21:00,['GMT-04:00'],"Ottawa, Ontario, Canada",Canadian Tire Centre,https://www.ufc.com/event/ufc-fight-night-may-04-2019,917
UFC Fight Night: Jacare vs. Hermansson,2019-04-27,21:30,['GMT-04:00'],"Sunrise, Florida, USA",BB&T Center,https://www.ufc.com/event/ufc-fight-night-april-27-2019,916
UFC Fight Night: Overeem vs. Oleinik,2019-04-20,14:00,['GMT+03:00'],"Saint Petersburg, Saint Petersburg, Russia",Yubileyny Sports Palace,https://www.ufc.com/event/ufc-fight-night-april-20-2019,915
UFC 236: Holloway vs. Poirier 2,2019-04-13,22:15,['GMT-04:00'],"Atlanta, Georgia, USA",State Farm Arena,https://www.ufc.com/event/ufc-236,914
UFC Fight Night: Barboza vs. Gaethje,2019-03-30,19:30,['GMT-04:00'],"Philadelphia, Pennsylvania, USA",Wells Fargo Center,https://www.ufc.com/event/ufc-fight-night-march-30-2019,913
UFC Fight Night: Thompson vs. Pettis,2019-03-23,21:00,['GMT-05:00'],"Nashville, Tennessee, USA",Bridgestone Arena,https://www.ufc.com/event/ufc-fight-night-march-23-2019,912
UFC Fight Night: Till vs. Masvidal,2019-03-16,17:00,['GMT+00:00'],"London, England, United Kingdom",The O2 Arena,https://www.ufc.com/event/ufc-fight-night-london-2019,911
UFC Fight Night: Lewis vs. Dos Santos,2019-03-09,22:00,['GMT-06:00'],"Wichita, Kansas, USA",Intrust Bank Arena,https://www.ufc.com/event/ufc-fight-night-march-9-2019,910
UFC 235: Jones vs. Smith,2019-03-02,23:30,['GMT-08:00'],"Las Vegas, Nevada, USA",T-Mobile Arena,https://www.ufc.com/event/ufc-235,908
UFC Fight Night: Blachowicz vs. Santos,2019-02-23,16:00,['GMT+01:00'],"Prague, , Czech Republic",O2 Arena,https://www.ufc.com/event/ufc-fight-night-czech-republic-2019,909
UFC Fight Night: Ngannou vs. Velasquez,2019-02-17,22:30,['GMT-07:00'],"Phoenix, Arizona, USA",Footprint Center,https://www.ufc.com/event/ufc-fight-night-phoenix-2019,907
UFC 234: Adesanya vs. Silva,2019-02-10,00:00,['GMT+11:00'],"Melbourne, Victoria, Australia",Rod Laver Arena,https://www.ufc.com/event/ufc-234,905
UFC Fight Night: Assuncao vs. Moraes 2,2019-02-02,22:00,['GMT-03:00'],"Fortaleza, Ceara, Brazil",Centro de Formação Olímpica do Nordeste,https://www.ufc.com/event/ufc-fight-night-brazil-2019,906
UFC Fight Night: Cejudo vs. Dillashaw,2019-01-19,23:00,['GMT-05:00'],"Brooklyn, New York, USA",Barclays Center,https://www.ufc.com/event/ufc-fight-night-brooklyn-jan-19-2019,903
UFC 232: Jones vs. Gustafsson 2,2018-12-29,23:15,['GMT-08:00'],"Los Angeles, California, USA",The Forum,https://www.ufc.com/event/ufc-232,902
UFC Fight Night: Lee vs. Iaquinta,2018-12-15,21:00,['GMT-06:00'],"Milwaukee, Wisconsin, USA",Fiserv Forum,https://www.ufc.com/event/ufc-milwaukee-2018,896
UFC 231: Holloway vs. Ortega,2018-12-08,23:00,['GMT-05:00'],"Toronto, Ontario, Canada",Scotiabank Arena,https://www.ufc.com/event/ufc-231,893
UFC Fight Night: Dos Santos vs. Tuivasa,2018-12-02,00:00,['GMT+10:30'],"Adelaide, South Australia, Australia",Adelaide Entertainment Centre,https://www.ufc.com/event/ufc-australia-2018,901
The Ultimate Fighter: Heavy Hitters Finale,2018-11-30,23:30,['GMT-08:00'],"Las Vegas, Nevada, USA",Pearl Concert Theater,https://www.ufc.com/event/tuf-28-finale-2018,894
UFC Fight Night: Blaydes vs. Ngannou 2,2018-11-24,08:15,['GMT+08:00'],"Beijing, , China",Cadillac Arena,https://www.ufc.com/event/ufc-china-2018,897
UFC Fight Night: Magny vs. Ponzinibbio,2018-11-18,00:00,['GMT-03:00'],"Buenos Aires, Buenos Aires, Argentina",Parque Roca Arena,https://www.ufc.com/event/ufc-south-america-2018,898
UFC Fight Night: Korean Zombie vs. Rodriguez,2018-11-11,00:00,['GMT-07:00'],"Denver, Colorado, USA",Ball Arena,https://www.ufc.com/event/ufc-denver-2018,892
UFC 230: Cormier vs. Lewis,2018-11-03,22:15,['GMT-04:00'],"New York City, New York, USA",Madison Square Garden,https://www.ufc.com/event/ufc-230,891
UFC Fight Night: Oezdemir vs. Smith,2018-10-27,22:30,['GMT-03:00'],"Moncton, New Brunswick, Canada",Avenir Centre,https://www.ufc.com/event/ufc-moncton-2018,890
UFC 229: Khabib vs. McGregor,2018-10-06,22:30,['GMT-07:00'],"Las Vegas, Nevada, USA",T-Mobile Arena,https://www.ufc.com/event/ufc-229,887
UFC Fight Night: Marreta vs. Anders,2018-09-22,22:30,['GMT-03:00'],"Sao Paulo, Sao Paulo, Brazil",Ginasio do Ibirapuera,https://www.ufc.com/event/fight-night-sao-paulo-sept-22-2018,879
UFC Fight Night: Hunt vs. Oleinik,2018-09-15,14:45,['GMT+03:00'],"Moscow, Moscow, Russia",Olympic Stadium,https://www.ufc.com/event/fight-night-moscow-sept-15-2018,878
UFC 228: Woodley vs. Till,2018-09-08,22:15,['GMT-05:00'],"Dallas, Texas, USA",American Airlines Center,https://www.ufc.com/event/ufc-228,886
UFC Fight Night: Gaethje vs. Vick,2018-08-25,22:30,['GMT-05:00'],"Lincoln, Nebraska, USA",Pinnacle Bank Arena,https://www.ufc.com/event/fight-night-lincoln-2018,882
UFC 227: Dillashaw vs. Garbrandt 2,2018-08-04,22:30,['GMT-07:00'],"Los Angeles, California, USA",Staples Center,https://www.ufc.com/event/ufc-227,871
UFC Fight Night: Alvarez vs. Poirier 2,2018-07-28,20:00,['GMT-06:00'],"Calgary, Alberta, Canada",Scotiabank Saddledome,https://www.ufc.com/event/fight-night-canada-july-28-2018,876
UFC Fight Night: Shogun vs. Smith,2018-07-22,14:30,['GMT+02:00'],"Hamburg, Hamburg, Germany",Barclaycard Arena,https://www.ufc.com/event/fight-night-hamburg-2018,875
UFC Fight Night: Dos Santos vs. Ivanov,2018-07-14,22:30,['GMT-06:00'],"Boise, Idaho, USA",CenturyLink Arena,https://www.ufc.com/event/fight-night-boise-2018,874
UFC 226: Miocic vs. Cormier,2018-07-07,23:00,['GMT-07:00'],"Las Vegas, Nevada, USA",T-Mobile Arena,https://www.ufc.com/event/ufc-226,864
The Ultimate Fighter: Undefeated Finale,2018-07-06,23:00,['GMT-07:00'],"Las Vegas, Nevada, USA",Pearl Concert Theater,https://www.ufc.com/event/the-ultimate-fighter-finale-july-6-2018,873
UFC Fight Night: Cowboy vs. Edwards,2018-06-23,08:30,['GMT+08:00'],"Kallang, , Singapore",Singapore Indoor Stadium,https://www.ufc.com/event/fight-night-asia-june-2018,872
UFC 225: Whittaker vs. Romero 2,2018-06-09,22:15,['GMT-05:00'],"Chicago, Illinois, USA",United Center,https://www.ufc.com/event/ufc-225,866
UFC Fight Night: Rivera vs. Moraes,2018-06-01,23:00,['GMT-04:00'],"Utica, New York, USA",Adirondack Bank Center,https://www.ufc.com/event/fight-night-utica-2018,868
UFC Fight Night: Thompson vs. Till,2018-05-27,14:30,['GMT+01:00'],"Liverpool, England, United Kingdom",Echo Arena,https://www.ufc.com/event/fight-night-liverpool-2018,870
UFC Fight Night: Maia vs. Usman,2018-05-19,22:30,['GMT-04:00'],"Santiago, , Chile",Movistar Arena,https://www.ufc.com/event/fight-night-santiago-2018,869
UFC 224: Nunes vs. Pennington,2018-05-12,22:15,['GMT-03:00'],"Rio de Janeiro, Rio de Janeiro, Brazil",Farmasi Arena,https://www.ufc.com/event/ufc-224,867
UFC Fight Night: Barboza vs. Lee,2018-04-21,23:30,['GMT-04:00'],"Atlantic City, New Jersey, USA",Boardwalk Hall,https://www.ufc.com/event/fight-night-atlantic-city-2018,865
UFC Fight Night: Poirier vs. Gaethje,2018-04-14,19:30,['GMT-07:00'],"Glendale, Arizona, USA",Gila River Arena,https://www.ufc.com/event/ufc-fight-night-april-14-2018,863
UFC 223: Khabib vs. Iaquinta,2018-04-08,00:00,['GMT-04:00'],"Brooklyn, New York, USA",Barclays Center,https://www.ufc.com/event/ufc-223,862
UFC Fight Night: Werdum vs. Volkov,2018-03-17,18:00,['GMT+00:00'],"London, England, United Kingdom",The O2 Arena,https://www.ufc.com/event/ufc-fight-night-london-march-17-2018,861
UFC 222: Cyborg vs. Kunitskaya,2018-03-03,23:30,['GMT-08:00'],"Las Vegas, Nevada, USA",T-Mobile Arena,https://www.ufc.com/event/ufc-222,858
UFC Fight Night: Emmett vs. Stephens,2018-02-24,21:15,['GMT-05:00'],"Orlando, Florida, USA",Amway Center,https://www.ufc.com/event/ufc-fight-night-orlando-february-24-2018,860
UFC Fight Night: Cerrone vs. Medeiros,2018-02-18,23:00,['GMT-06:00'],"Austin, Texas, USA",Frank Erwin Center,https://www.ufc.com/event/ufc-fight-night-austin-february-18-2018,859
UFC 221: Romero vs. Rockhold,2018-02-10,23:30,['GMT+08:00'],"Perth, Western Australia, Australia",RAC Arena,https://www.ufc.com/event/ufc-221,857
UFC Fight Night: Machida vs. Anders,2018-02-04,00:30,['GMT-03:00'],"Belem, Para, Brazil",Arena Guilherme Paraense (Mangueirinho),https://www.ufc.com/event/ufc-fight-night-belem-february-3-2018,856
UFC Fight Night: Jacare vs. Brunson 2,2018-01-27,21:00,['GMT-05:00'],"Charlotte, North Carolina, USA",Spectrum Center,https://www.ufc.com/event/ufc-fight-night-charlotte-january-27-2018,855
UFC 220: Miocic vs. Ngannou,2018-01-21,00:00,['GMT-05:00'],"Boston, Massachusetts, USA",TD Garden,https://www.ufc.com/event/ufc-220,854
UFC Fight Night: Stephens vs. Choi,2018-01-14,23:30,['GMT-06:00'],"St. Louis, Missouri, USA",Enterprise Center,https://www.ufc.com/event/ufc-fight-night-st-louis-january-14-2018,853
UFC 219: Cyborg vs. Holm,2017-12-31,00:30,['GMT-08:00'],"Las Vegas, Nevada, USA",T-Mobile Arena,https://www.ufc.com/event/ufc-219,851
UFC Fight Night: Lawler vs. Dos Anjos,2017-12-16,21:30,['GMT-06:00'],"Winnipeg, Manitoba, Canada",Bell MTS Place,https://www.ufc.com/event/ufc-fight-night-winnipeg-dec-16-2017,848
UFC Fight Night: Swanson vs. Ortega,2017-12-09,23:30,['GMT-08:00'],"Fresno, California, USA",Save Mart Center,https://www.ufc.com/event/ufc-fight-night-fresno-dec-9-2017,852
UFC 218: Holloway vs. Aldo 2,2017-12-02,23:15,['GMT-05:00'],"Detroit, Michigan, USA",Little Caesars Arena,https://www.ufc.com/event/ufc-218,850
The Ultimate Fighter: A New World Champion Finale,2017-12-02,00:30,['GMT-08:00'],"Las Vegas, Nevada, USA",Park Theatre,https://www.ufc.com/event/the-ultimate-fighter-finale-dec-1-2017,849
UFC Fight Night: Bisping vs. Gastelum,2017-11-25,08:45,['GMT+08:00'],"Shanghai, Hebei, China",Mercedes-Benz Arena,https://www.ufc.com/event/ufc-fight-night-shanghai-nov-25-2017,844
UFC Fight Night: Werdum vs. Tybura,2017-11-18,23:30,['GMT+11:00'],"Sydney, New South Wales, Australia",Qudos Bank Arena,https://www.ufc.com/event/ufc-fight-night-sydney-2017,836
UFC Fight Night: Poirier vs. Pettis,2017-11-12,00:00,['GMT-05:00'],"Norfolk, Virginia, USA",Chartway Arena,https://www.ufc.com/event/ufc-fight-night-norfolk-nov-11-2017,846
UFC 217: Bisping vs. St-Pierre,2017-11-04,23:00,['GMT-04:00'],"New York City, New York, USA",Madison Square Garden,https://www.ufc.com/event/ufc-217,845
UFC Fight Night: Brunson vs. Machida,2017-10-28,23:00,['GMT-02:00'],"Sao Paulo, Sao Paulo, Brazil",Ginasio do Ibirapuera,https://www.ufc.com/event/ufc-fight-night-brazil-oct-28-2017,847
UFC Fight Night: Cerrone vs. Till,2017-10-21,16:00,['GMT+02:00'],"Gdansk, , Poland",Ergo Arena,https://www.ufc.com/event/ufc-fight-night-poland-2017,831
UFC 216: Ferguson vs. Lee,2017-10-07,23:00,['GMT-07:00'],"Las Vegas, Nevada, USA",T-Mobile Arena,https://www.ufc.com/event/ufc-216,843
UFC Fight Night: Saint Preux vs. Okami,2017-09-23,00:00,['GMT+09:00'],"Saitama, Saitama, Japan",Saitama Super Arena,https://www.ufc.com/event/ufc-fight-night-japan-2017,835
UFC Fight Night: Rockhold vs. Branch,2017-09-17,00:00,['GMT-04:00'],"Pittsburgh, Pennsylvania, USA",PPG Paints Arena,https://www.ufc.com/event/ufc-fight-night-pittsburgh-2017,837
UFC 215: Nunes vs Shevchenko 2,2017-09-09,23:00,['GMT-06:00'],"Edmonton, Alberta, Canada",Rogers Place,https://www.ufc.com/event/ufc-215,830
UFC Fight Night: Volkov vs. Struve,2017-09-02,15:45,['GMT+02:00'],"Rotterdam, Zuid-Holland, Netherlands",Ahoy Rotterdam,https://www.ufc.com/event/ufc-fight-night-rotterdam-2017,829
UFC Fight Night: Pettis vs. Moreno,2017-08-05,23:00,['GMT-05:00'],"Mexico City, Distrito Federal, Mexico",Arena CDMX,https://www.ufc.com/event/ufc-fight-night-mexico-city-2017,828
UFC 214: Cormier vs. Jones 2,2017-07-29,22:30,['GMT-07:00'],"Anaheim, California, USA",Honda Center,https://www.ufc.com/event/ufc-214,823
UFC Fight Night: Weidman vs. Gastelum,2017-07-22,20:00,['GMT-04:00'],"Uniondale, New York, USA",Nassau Veterans Memorial Coliseum,https://www.ufc.com/event/ufc-fight-night-long-island-2017,825
UFC Fight Night: Nelson vs. Ponzinibbio,2017-07-16,16:00,['GMT+01:00'],"Glasgow, Scotland, United Kingdom",The SSE Hydro,https://www.ufc.com/event/ufc-fight-night-glasgow-2017,822
UFC 213: Romero vs. Whittaker,2017-07-08,23:00,['GMT-07:00'],"Las Vegas, Nevada, USA",T-Mobile Arena,https://www.ufc.com/event/ufc-213,827
The Ultimate Fighter: Redemption Finale,2017-07-07,22:30,['GMT-07:00'],"Las Vegas, Nevada, USA",T-Mobile Arena,https://www.ufc.com/event/the-ultimate-fighter-redemption-finale,826
UFC Fight Night: Chiesa vs. Lee,2017-06-25,21:30,['GMT-05:00'],"Oklahoma City, Oklahoma, USA",Chesapeake Energy Arena,https://www.ufc.com/event/ufc-fight-night-oklahoma-city-2017,824
UFC Fight Night: Holm vs. Correia,2017-06-17,08:45,['GMT+08:00'],"Kallang, , Singapore",Singapore Indoor Stadium,https://www.ufc.com/event/ufc-fight-night-singapore-2017,821
